key,title,year,month,day,journal,issn,volume,issue,pages,authors,url,language,publisher,location,abstract,notes,doi,keywords,pubmed_id,pmc_id
rayyan-1268391156,Association Between Exposure to Per- and Polyfluoroalkyl Substances and Birth Outcomes: A Systematic Review and Meta-Analysis,2022,NA,NA,Frontiers in Public Health,22962565 (ISSN),10,NA,,"Gui, S.-Y. and Chen, Y.-N. and Wu, K.-J. and Liu, W. and Wang, W.-J. and Liang, H.-R. and Jiang, Z.-X. and Li, Z.-L. and Hu, C.-Y.",https://www.scopus.com/inward/record.uri?eid=2-s2.0-85128080810&doi=10.3389%2ffpubh.2022.855348&partnerID=40&md5=cdd8284a4e274f60c3d69af18c4d1496,English,Frontiers Media S.A.,"[""Department of Ophthalmology, The Second Affiliated Hospital of Anhui Medical University, Hefei, China"", ""Department of Clinical Medicine, The Second School of Clinical Medicine, Anhui Medical University, Hefei, China"", ""Department of Pharmacy, School of Clinical Pharmacy, Anhui Medical University, Hefei, China"", ""Department of Clinical Medicine, The First School of Clinical Medicine, Anhui Medical University, Hefei, China"", ""Department of General Surgery, The Second Affiliated Hospital of Anhui Medical University, Hefei, China"", ""Department of Gynecology and Obstetrics, The First Affiliated Hospital of Anhui Medical University, Hefei, China"", ""Department of Humanistic Medicine, School of Humanistic Medicine, Anhui Medical University, Hefei, China"", ""Department of Epidemiology and Biostatistics, School of Public Health, Anhui Medical University, Hefei, China""]","Background: A large body of emerging evidence suggests that per- and polyfluoroalkyl substances (PFAS) affect birth outcomes in various pathways, but the evidence is inconsistent. Therefore, this study aimed to systematically review the epidemiological evidence on PFAS exposure and birth outcomes. Methods: Three electronic databases were searched for epidemiological studies through February 13, 2021. We used random-effects meta-analysis for eight birth outcome indicators to calculate summary effect estimates for various exposure types. The risk of bias and the overall quality and level of evidence for each exposure-outcome pair were assessed. Results: The initial search identified 58 potentially eligible studies, of which 46 were ultimately included. Many PFAS were found to have previously unrecognized statistically significant associations with birth outcomes. Specifically, birth weight (BW) was associated with PFAS, with effect sizes ranging from 181.209 g (95% confidence interval (CI) = 360.620 to 1.798) per 1 ng/ml increase in perfluoroheptanesulfonate (PFHpS) to 24.252 g (95% CI = 38.574 to 9.930) per 1 ln (ng/ml) increase in perfluorodecaoic acid (PFDA). Similar patterns were observed between other PFAS and birth outcomes: perfluorooctanoic acid (PFOA) and perfluorooctane sulfonate (PFOS) with birth length (BL) and ponderal index (PI), PFOS and perfluorododecanoic acid (PFDoDA) with head circumference (HC), PFHpS with gestational age (GA), and perfluorononanoic acid (PFNA) and PFHpS with preterm birth (PTB). Additionally, PFDA showed a statistically significant association with small for gestational age (SGA). The level of the combined evidence for each exposure-outcome pair was considered to be moderate. Conclusion: This study showed that PFAS exposure was significantly associated with increased risks of various adverse birth outcomes and that different birth outcome indicators had different degrees of sensitivity to PFAS. Further studies are needed to confirm our results by expanding the sample size, clarifying the effects of different types or doses of PFAS and the time of blood collection on birth outcomes, and fully considering the possible confounders. Copyright  2022 Gui, Chen, Wu, Liu, Wang, Liang, Jiang, Li and Hu.","Export Date: 08 April 2024; Cited By: 23; Correspondence Address: Z.-L. Li; Department of Gynecology and Obstetrics, The First Affiliated Hospital of Anhui Medical University, Hefei, China; email: lizelian50704@163.com; C.-Y. Hu; Department of Humanistic Medicine, School of Humanistic Medicine, Anhui Medical University, Hefei, China; email: cy.hu@ahmu.edu.cn | RAYYAN-INCLUSION: {""Lorenzo""=>""Included"", ""Kyle ""=>""Included""}",10.3389/fpubh.2022.855348,"birth outcome;birth weight;meta-analysis;per- and polyfluoroalkyl substances;systematic review;Environmental Pollutants;Fluorocarbons;Gestational Age;Humans;Infant, Newborn;Premature Birth;fluorocarbon;adverse event;gestational age;human;meta analysis;newborn;pollutant;prematurity",NA,NA
rayyan-1268391158,The associations between endocrine disrupting chemicals and markers of inflammation and immune responses: A systematic review and meta-analysis,2022,NA,NA,Ecotoxicology and Environmental Safety,01476513 (ISSN),234,NA,,"Liu, Z. and Lu, Y. and Zhong, K. and Wang, C. and Xu, X.",https://www.scopus.com/inward/record.uri?eid=2-s2.0-85125809495&doi=10.1016%2fj.ecoenv.2022.113382&partnerID=40&md5=84e1340b8fd771b9a859d3a2a484a219,English,Academic Press,"School of Environmental and Biological Engineering, Nanjing University of Science and Technology, Nanjing, 210094, China","Exposure to endocrine disrupting chemicals (EDCs) may lead to dysregulated inflammatory responses, however, the detailed relationship between different EDCs and inflammation remains unclear. A systematic review and meta-analysis was conducted to evaluate the associations between four types of EDCs (bisphenol A (BPA), phthalates (PAEs), organochlorine pesticides (OCPs), and polychlorinated biphenyls (PCBs)) and markers of inflammation and immune responses in humans. Three databases were searched, and 36 studies with a total of 22055 participants were included. The associations between EDCs and 26 inflammation-related acute phase proteins and cytokines were analyzed. The results demonstrated that exposure to BPA was positively associated with circulating levels of C-reactive protein (CRP) and interleukin (IL)-6. Exposure to PAEs was associated with elevated levels of CRP, IL-6 and IL-10. Subgroup analysis found that three PAE metabolites mono-benzyl phthalate (MBzP), mono-isobutyl phthalate (MiBP), and mono-n-butyl phthalate (MnBP) were directly associated with a higher level of CRP, and two other PAE metabolites mono-carboxyisononyl phthalate (MCNP) and mono-3-carboxypropyl phthalate (MCPP) were positively associated with IL-6. The positive associations between PAEs and CRP, IL-6 and IL-10 were significant in the high-molecular-weight phthalate (HMWP) exposure group, not the low-molecular-weight phthalate (LMWP) exposure group. Exposure to OCPs was positively associated with CRP, IL-1, IL-2, and IL-10. No significant association was found between PCBs and inflammatory markers. These findings demonstrate that exposure to EDCs is closely linked to dysregulated inflammatory responses. More studies should be conducted in the future to get a comprehensive view of the associations between different EDCs and inflammation, and investigations on the underlying mechanisms are needed.  2022 The Authors","Export Date: 08 April 2024; Cited By: 28; Correspondence Address: X. Xu; School of Environmental and Biological Engineering, Nanjing University of Science and Technology, Nanjing, 200 Xiaolingwei Street, 210094, China; email: xuxi@njust.edu.cn; CODEN: EESAD | RAYYAN-INCLUSION: {""Lorenzo""=>""Included"", ""Kyle ""=>""Included""}",10.1016/j.ecoenv.2022.113382,"Endocrine disrupting chemicals;Inflammation;Meta-analysis;Systematic review;4,4' isopropylidenediphenol;benzene derivative;C reactive protein;cytokine;endocrine disruptor;interleukin 10;interleukin 1beta;interleukin 2;interleukin 6;organochlorine pesticide;phthalic acid;polychlorinated biphenyl;immune response;meta-analysis;pollution exposure;protein;environmental exposure;human;inflammation;protein analysis;Review;systematic review",NA,NA
rayyan-1268391174,Assessing the risk of diabetes in participants with DDT DDE exposure- A systematic review and meta-analysis,2022,NA,NA,Environmental Research,00139351 (ISSN),210,NA,,"Yipei, Y. and Zhilin, L. and Yuhong, L. and Meng, W. and Huijun, W. and Chang, S. and Yan, H.",https://www.scopus.com/inward/record.uri?eid=2-s2.0-85125622097&doi=10.1016%2fj.envres.2022.113018&partnerID=40&md5=ae73c08796b30e943afd122d016d2928,English,Academic Press Inc.,"[""Peking University Health Science Center, China"", ""Harbin Medical University, China"", ""Chinese Center for Disease Control and Prevention National Institute for Nutrition and Health Key Laboratory of Trace Element Nutrition, National Health Commission of the People's Republic of China, China""]","We have performed a systematic review and meta-analysis of the association between DDT/DDE and diabetes, searching PubMed, Embase, and Cochrane for relevant articles published up to August 30, 2021, and eventually including 43 publications. Our researchers evaluate included studies quality and risk of bias via the recommended tool. This study uses meta-analyses of random effects of each exposure and outcome to estimate combined odds ratios (ORs) and 95% confidence intervals (CIs). Our research identified 43 cross-sectional, case-control, and cohort studies, including 40,141 individuals in America, Europe, Asia, and Africa. The summary ORs (95% CIs) of incident diabetes were 1.61 (1.102.39) for DDT, 1.67 (1.411.98) for DDE. The subgroup analysis indicated that the association is significantly higher in the region of Asia for both DDT (OR = 2.73) and DDE (OR = 2.62). Besides, we also tried various types of stratification to identify the more influential confounding factors, among which regional factors have a significant influence. Study evidence suggests that exposure to DDT and its breakdown product, DDE, might be associated with the risk of incident diabetes. Among Asian patients, DDT/DDE concentrations are more closely associated with diabetes. Further studies in specific regions will be considered in the future.  2022","Export Date: 08 April 2024; Cited By: 6; Correspondence Address: W. Huijun; Chinese Center for Disease Control and Prevention National Institute for Nutrition and Health Key Laboratory of Trace Element Nutrition, National Health Commission of the People's Republic of China, China; email: wanghj@ninh.chinacdc.cn; CODEN: ENVRA | RAYYAN-INCLUSION: {""Lorenzo""=>""Included"", ""Kyle ""=>""Included""}",10.1016/j.envres.2022.113018,"DDE;DDT;Diabetes;Meta-analysis;Systematic review;Cohort Studies;Cross-Sectional Studies;Diabetes Mellitus;Dichlorodiphenyl Dichloroethylene;Humans;Africa;Aisen;Asia;Chile;Cochrane;Europe;1,1 dichloro 2,2 bis(4 chlorophenyl)ethylene;chlorphenotane;diabetes;meta-analysis;risk;stratification;confidence interval;confounding variable;diabetes mellitus;human;meta analysis;odds ratio;Review;risk assessment;sensitivity analysis;systematic review;Western Hemisphere;cohort analysis;cross-sectional study;Risk Assessment",NA,NA
rayyan-1268391186,Associations between exposure to perfluoroalkyl substances and birth outcomes: A meta-analysis,2022,NA,NA,Chemosphere,00456535 (ISSN),291,NA,,"Yang, Z. and Liu, H.-Y. and Yang, Q.-Y. and Chen, X. and Li, W. and Leng, J. and Tang, N.-J.",https://www.scopus.com/inward/record.uri?eid=2-s2.0-85119277717&doi=10.1016%2fj.chemosphere.2021.132909&partnerID=40&md5=f37f7f1bcb7f196bf802879aac65a5b9,English,Elsevier Ltd,"[""Department of Occupational and Environmental Health, School of Public Health, Tianjin Medical University, Tianjin, 300070, China"", ""Tianjin Key Laboratory of Environment, Nutrition, and Public Health, Tianjin Medical University, Tianjin, 300070, China"", ""Center for International Collaborative Research on Environment, Nutrition and Public Health, Tianjin, 300070, China"", ""Tianjin Women and Children's Health Center, Tianjin, 300070, China""]","Although previous meta-analyses have shown that prenatal PFASs exposure is associated with reduction in birth weight, effects of prenatal PFASs exposure on birth outcomes have not been fully explored. We conducted a meta-analysis of 23 eligible studies searched from Embase, PubMed, and Web of Science before March 21, 2021 to analyze the association between prenatal PFASs exposure and birth outcomes, including premature birth (PTB), low birth weight (LBW), small for gestational age (SGA) and miscarriage. Odds ratio (OR) and corresponding confidence intervals were extracted for analysis. According to the heterogeneity of the included studies, fixed-effects (I2  50%) and random-effects (I2 > 50%) models were applied respectively. The significant associations between PFOS and PTB (pooled OR = 1.54, 95% CI: 1.201.98), PFOA and miscarriage (pooled OR = 1.40, 95% CI: 1.151.70), and PFOS and LBW (pooled OR = 1.52, 95% CI: 1.191.94) were obtained. There were differences between included studies with different study regions, sampling time, and samples type used for PFASs assessment. These findings may provide insight in risk assessment and decision-making in producing products that contain PFASs.  2021 Elsevier Ltd","Export Date: 08 April 2024; Cited By: 8; Correspondence Address: J. Leng; Tianjin Women and Children's Health Center, Tianjin, 300070, China; email: ljhlzqljhlzq@163.com; N.-J. Tang; Department of Occupational and Environmental Health, School of Public Health, Tianjin Medical University, Tianjin, 300070, China; email: tangnaijun@tmu.edu.cn; CODEN: CMSHA | RAYYAN-INCLUSION: {""Lorenzo""=>""Included"", ""Kyle ""=>""Included""}",10.1016/j.chemosphere.2021.132909,"Birth outcomes;Meta-analysis;Perfluoroalkyl substances;Birth Weight;Environmental Pollutants;Female;Fluorocarbons;Humans;Infant, Low Birth Weight;Infant, Newborn;Maternal Exposure;Pregnancy;Premature Birth;Decision making;Random processes;fluorocarbon;organic compound;perfluoro compound;perfluoroalkyl;unclassified drug;% reductions;Birth outcome;Birth weight;Confidence interval;Gestational age;Low birth weights;Odd ratios;Web of Science;birth rate;heterogeneity;meta-analysis;risk assessment;sampling;confidence interval;decision making;diastolic blood pressure;hazard ratio;human;limit of detection;lipid metabolism;low birth weight;meta analysis;newborn;Newcastle-Ottawa scale;odds ratio;outcome assessment;pregnancy outcome;quality control;Review;sensitivity analysis;small for date infant;spontaneous abortion;adverse event;birth weight;female;maternal exposure;pollutant;pregnancy;prematurity;toxicity;Risk assessment",NA,NA
rayyan-1268391200,To which extent are per-and poly-fluorinated substances associated to metabolic syndrome?,2022,NA,NA,Reviews on Environmental Health,00487554 (ISSN),37,2,211-228,"Zare Jeddi, M. and Soltanmohammadi, R. and Barbieri, G. and Fabricio, A.S.C. and Pitter, G. and Dalla Zuanna, T. and Canova, C.",https://www.scopus.com/inward/record.uri?eid=2-s2.0-85107064088&doi=10.1515%2freveh-2020-0144&partnerID=40&md5=336bea02fcb2e0b3589b0d733435fb3a,English,De Gruyter Open Ltd,"[""Unit Of Biostatistics, Epidemiology And Public Health, Department Of Cardio-Thoraco-Vascular Sciences And Public Health, University Of Padua, Padova, Italy"", ""Regional Center For Biomarkers, Department Of Clinical Pathology, Azienda ULSS 3 Serenissima, Venice, Italy"", ""Screening And Health Impact Assessment Unit, Azienda Zero-Veneto Region, Padova, Italy""]","Exposure to per-and polyfluoroalkyl substances (PFAS), ubiquitous persistent environmental contaminants, has led to substantial global concern due to their potential environmental and human health effects. Several epidemiological studies have assessed the possible association between PFAS exposure and risk of metabolic syndrome (MetS), however, the results are ambiguous. The aim of this study was to assess the current human epidemiologic evidence on the association between exposure to PFAS and MetS. We performed a systematic search strategy using three electronic databases (PubMed, Scopus, and Web of Science) for relevant studies concerning the associations of PFAS with MetS and its clinical relevance from inception until January 2021. We undertook meta-analyses where there were five or more studies with exposure and outcomes assessments that were reasonably comparable. The pooled odd ratios (ORs) were calculated using random effects models and heterogeneity among studies was assessed by I2 index and Q test. A total of 12 cross-sectional studies (10 studies on the general population and two studies in the occupational settings) investigated the association between PFAS exposure and MetS. We pooled data from seven studies on the general population for perfluorooctanoic acid (PFOA) and perfluorooctanesulfonate (PFOS) and five studies for perfluorohexanesulfonate (PFHxS) and perfluorononanoic acid (PFNA). Predominately, most studies reported no statistically significant association between concentrations of PFAS and MetS. In the meta-analysis, the overall measure of effect was not statistically significant, showing no evidence of an association between concentrations of PFOA, PFOS, PFNA, and PFHxS and the risk of MetS. Based on the results of the meta-analysis, current small body of evidence does not support association between PFAS and MetS. However, due to limited number of studies and substantial heterogeneity, results should be interpreted with caution. Further scrutinizing cohort studies are needed to evaluate the association between various and less well-known PFAS substances and their mixture with MetS and its components in both adults and children in different settings.   2021 Maryam Zare Jeddi et al., published by De Gruyter, Berlin/Boston.","Export Date: 08 April 2024; Cited By: 5; Correspondence Address: C. Canova; Unit Of Biostatistics, Epidemiology And Public Health, Department Of Cardio-Thoraco-Vascular Sciences And Public Health, University Of Padua, Padova, Italy; email: cristina.canova@unipd.it; CODEN: REVHA | RAYYAN-INCLUSION: {""Lorenzo""=>""Included"", ""Kyle ""=>""Included""}",10.1515/reveh-2020-0144,"cardiometabolic risk factors;forever chemicals;insulin resistance;metabolic outcome;systematic review;Adult;Child;Cohort Studies;Cross-Sectional Studies;Environmental Pollutants;Fluorocarbons;Humans;Metabolic Syndrome;fluorocarbon;adult;child;cohort analysis;cross-sectional study;human;meta analysis;metabolic syndrome X;pollutant;toxicity;RNA, Messenger;Polyglactin 910;Poly(A)-Binding Protein II;Poly I-C;Poly(A)-Binding Proteins;Poly A-U;Poly(ADP-ribose) Polymerases",NA,NA
rayyan-1268391202,Effects of perinatal exposure to endocrine-disrupting chemicals on the reproductive system of F3 generation male rodents: a meta-analysis,2022,NA,NA,Environmental Science and Pollution Research,09441344 (ISSN),29,22,33218-33229,"He, H. and Chen, W. and Wei, Y. and Zhang, T. and Geng, W. and Zhai, J.",https://www.scopus.com/inward/record.uri?eid=2-s2.0-85122758083&doi=10.1007%2fs11356-021-18338-w&partnerID=40&md5=bb7b8e7d86fddf9b4c3f0853fc11e6eb,English,Springer Science and Business Media Deutschland GmbH,"Department of Occupational and Environmental Health, School of Public Health, Anhui Medical University, Meishan Rd 81, Hefei, 230032, China","To explore the relationship between perinatal exposure to endocrine-disrupting chemicals and the male reproductive system of F3 generation, and to evaluate the toxicological effects of endocrine-disrupting chemicals on the reproductive system of F3 generation male rodents. PubMed and Web of Science databases were searched to obtain the studies; overall risk ratios (RRs) with 95% confidence intervals (95% CIs) were used to evaluate the relationship between exposure to endocrine-disrupting chemicals and reproductive system damage in F3 generation male rodents. Nine studies were included for analysis. Endocrine-disrupting chemicals are significantly associated with the reproductive system of male rodents of F3 generation, especially the testis (RR = 3.13, 95% CI: 2.05, 4.76), prostate (RR = 2.26, 95% CI: 1.27, 4.00), and kidney (RR = 2.83, 95% CI: 1.77, 4.52), but the current analysis does not prove that EDCs are the adverse factors for puberty abnormalities. The results indicated that the overall associations between atrazine (RR = 3.06, 95% CI: 1.10, 8.51, P = 0.032), DDT (RR = 6.26, 95% CI: 1.56, 25.08, P = 0.010), pesticide and insect repellent mixture (permethrin and DEET) (RR = 2.23, 95% CI: 1.34, 3.69, P = 0.002), and vinclozolin (RR = 4.71, 95% CI: 2.74, 8.10, P = 0.000) and reproductive system damage in F3 generation male rodents were statistically significant. Our study indicated that EDCs have an atavistic effect on the male reproductive system, and we should pay attention to the long-term effects of environmental exposure to endocrine disruptors in future generations.  2022, The Author(s), under exclusive licence to Springer-Verlag GmbH Germany, part of Springer Nature.","Export Date: 08 April 2024; Cited By: 5; Correspondence Address: J. Zhai; Department of Occupational and Environmental Health, School of Public Health, Anhui Medical University, Hefei, Meishan Rd 81, 230032, China; email: jinxia.zhai@foxmail.com; CODEN: ESPLE | RAYYAN-INCLUSION: {""Lorenzo""=>""Included"", ""Kyle ""=>""Included""}",10.1007/s11356-021-18338-w,Endocrine-disrupting chemicals;Male reproduction;Meta-analysis;Transgenerational inheritance;Animals;Endocrine Disruptors;Environmental Exposure;Female;Male;Pesticides;Pregnancy;Rodentia;Testis;endocrine disruptor;pesticide;atrazine;DDT;insect;meta-analysis;pollution exposure;reproduction;rodent;animal;environmental exposure;female;male;meta analysis;pregnancy;testis,NA,NA
rayyan-1268391218,"Maternal exposure to endocrine disrupting chemicals (EDCs) and preterm birth: A systematic review, meta-analysis, and meta-regression analysis",2022,NA,NA,Environmental Pollution,02697491 (ISSN),292,NA,,"Wu, Y. and Wang, J. and Wei, Y. and Chen, J. and Kang, L. and Long, C. and Wu, S. and Shen, L. and Wei, G.",https://www.scopus.com/inward/record.uri?eid=2-s2.0-85116482908&doi=10.1016%2fj.envpol.2021.118264&partnerID=40&md5=705a8867400f1fe9ad5d22e62ba10e3f,English,Elsevier Ltd,"Department of Urology, Children's Hospital of Chongqing Medical University, Ministry of Education Key Laboratory of Child Development and Disorders, International Science and Technology Cooperation Base of Child Development and Critical Disorders, National Clinical Research Center for Child Health and Disorders, Chongqing Key Laboratory of Pediatrics, Chongqing Key Laboratory of Children Urogenital Development and Tissue Engineering, Chongqing, China","Preterm birth is the second most common cause of death in children under 5 years of age. The etiology of preterm birth has not yet been elucidated. Although maternal exposure to endocrine disrupting chemicals (EDCs) may increase the risk for preterm birth, associations have not been confirmed. We performed a meta-analysis to elucidate the relationships between maternal exposure to EDCs and preterm birth. A systematic search of PubMed, Ovid-EMBASE, and the Cochrane Library (CENTRAL) for relevant published studies providing quantitative data on the association between maternal EDC exposure and preterm birth in humans was conducted in July 2021. To calculate the overall estimates, we pooled the adjusted regression coefficients with 95% confidence intervals (CIs) from each study by the inverse variance method. A total of 59 studies were included. The pooled results indicated that maternal exposure to metals (OR, 1.23; 95% CI, 1.17 to 1.29) and phthalates (OR, 1.31; 95% CI, 1.21 to 1.42) was related to an increased risk for preterm birth. Specifically, maternal exposure to lead, cadmium, chromium, copper and manganese appeared to be correlated with an elevated risk for preterm birth. Additionally, maternal exposure to monoethyl phthalate (MEP), mono-2-ethyl-5-carboxypentyl phthalate (MECPP), monobenzyl phthalate (MBzP), and di (2-ethylhexyl) phthalate (DEHP) was also associated with preterm birth. In conclusion, maternal exposure to metals and phthalates may increase the risk for preterm birth based on current evidence.  2021 Elsevier Ltd","Export Date: 08 April 2024; Cited By: 25; Correspondence Address: G. Wei; Children's Hospital of Chongqing Medical University, Chongqing, No.136 Zhongshan Second Road, Yuzhong District, 400014, China; email: u806806@cqmu.edu.cn; CODEN: ENPOE | RAYYAN-INCLUSION: {""Lorenzo""=>""Included"", ""Kyle ""=>""Included""} | USER-NOTES: {""Lorenzo""=>[""need to check if it includes PFAS or OCPs""]}",10.1016/j.envpol.2021.118264,"Endocrine disrupting chemicals;Maternal exposure;Preterm birth;Child;Child, Preschool;Endocrine Disruptors;Environmental Exposure;Environmental Pollutants;Female;Humans;Infant, Newborn;Maternal Exposure;Phthalic Acids;Pregnancy;Premature Birth;Regression Analysis;Chemicals;Endocrine disrupters;Inverse problems;Regression analysis;1,1 dichloro 2,2 bis(4 chlorophenyl)ethylene;4 hydroxybenzoic acid ester;cadmium;chlorphenotane;chromium;copper;di (2 ethylhexyl) phthalate;endocrine disruptor;hexachlorobenzene;lead;lindane;manganese;mono 2 ethyl 5 carboxypentyl phthalate;monobenzyl phthalate;monoethyl phthalate;organochlorine derivative;perchlorate;phenol;phthalic acid;polychlorinated biphenyl;unclassified drug;phthalic acid derivative;Causes of death;Cochrane library;Confidence interval;Meta-analysis;Phthalates;Systematic Review;Systematic searches;chemical pollutant;health risk;literature review;maternal health;meta-analysis;pollution exposure;quantitative analysis;regression analysis;Article;human;premature labor;prenatal exposure;child;environmental exposure;female;maternal exposure;meta analysis;newborn;pollutant;pregnancy;prematurity;preschool child;Esters",NA,NA
