key,title,year,month,day,journal,issn,volume,issue,pages,authors,url,language,publisher,location,abstract,notes,doi,keywords,pubmed_id,pmc_id
rayyan-1268391076,Endocrine-disrupting chemicals and the risk of gestational diabetes mellitus: a systematic review and meta-analysis,2022,NA,NA,Environmental Health: A Global Access Science Source,1476069X (ISSN),21,1,,"Yan, D. and Jiao, Y. and Yan, H. and Liu, T. and Yan, H. and Yuan, J.",https://www.scopus.com/inward/record.uri?eid=2-s2.0-85130126226&doi=10.1186%2fs12940-022-00858-8&partnerID=40&md5=f576fddce44c38f9c76f78711630043c,English,BioMed Central Ltd,"[""Department of Pathology, Renmin Hospital of Wuhan University, 238 Jiefang-Road, Wuchang District, Wuhan, 430060, China"", ""Department of Health Toxicology, MOE Key Lab of Environment and Health, School of Public Health, Tongji Medical College, Huazhong University of Science and Technology, 13 Hangkong-Road, Wuhan, 430030, China""]","Objective: To conduct a comprehensive systematic review and meta-analysis to estimate the relationship between endocrine-disrupting chemicals (EDCs), including polychlorinated biphenyls (PCBs), poly-brominated diphenyl ethers (PBDEs), phthalates (PAEs), and per- and polyfluoroalkyl substances (PFAS) exposure and risk of gestational diabetes mellitus (GDM). Methods: Relevant studies from their inception to November 2021 were identified by searching EMBASE, PubMed, and Web of Science. The cohort and casecontrol studies that reported effect size with 95% confidence intervals (CIs) of EDC exposure and GDM were selected. The heterogeneity among the included studies was quantified by I2 statistic. Publication bias was evaluated through the Begg and Egger tests. Results: Twenty-five articles with a total of 23,796 participants were found. Results indicated that exposure to PCBs has a significant influence on the incidence of GDM (OR = 1.14; 95% CI = 1.00-1.31; n = 8). The risk of GDM was found to be associated with PBDE exposure (OR = 1.32; 95% CI = 1.151.53; n = 4). PAEs and PFASs exposure were also positively associated with the risk of GDM, with summary ORs of 1.10 (95% CI = 1.031.16; n = 7 for PAEs) and 1.09 (95% CI = 1.021.16; n = 11 for PFASs), respectively. When only cohort studies were considered, the summary OR between PCBs exposure and the risk of GDM was 0.99 (95% CI = 0.911.09; n = 5). Meanwhile, the summary ORs from cohort studies for PBDEs, PAEs, and PFASs exposure were 1.12 (95% CI = 1.001.26; n = 2), 1.08 (95% CI = 1.021.15; n = 5), and 1.06 (95% CI = 1.001.12; n = 8), respectively. The Beggs and Egger tests did not show publication bias, and the sensitivity analyses did not change the results in this meta-analysis. Conclusion: These results support that exposure to certain EDCs, including PCBs, PBDEs, PAEs, and PFAS, increase the risk of GDM. Further large-sample epidemiologic researches and mechanistic studies are needed to verify the potential relationship and biological mechanisms. These results are of public health significance because the daily EDC exposure is expected to increase the risk of GDM development. Graphical Abstract: [Figure not available: see fulltext.]  2022, The Author(s).","Export Date: 08 April 2024; Cited By: 29; Correspondence Address: J. Yuan; Department of Pathology, Renmin Hospital of Wuhan University, Wuhan, 238 Jiefang-Road, Wuchang District, 430060, China; email: yuanjingping@whu.edu.cn | RAYYAN-INCLUSION: {""Lorenzo""=>""Included"", ""Kyle ""=>""Included""}",10.1186/s12940-022-00858-8,"Endocrine-disrupting chemical;Gestational diabetes mellitus;Meta-analysis;Risk factor;Systematic review;Diabetes, Gestational;Endocrine Disruptors;Environmental Pollutants;Female;Fluorocarbons;Halogenated Diphenyl Ethers;Humans;Polychlorinated Biphenyls;Pregnancy;endocrine disruptor;perfluoroalkyl substance;phthalic acid;polybrominated diphenyl ether;polychlorinated biphenyl;polyfluoroalkyl substance;unclassified drug;diphenyl ether derivative;fluorocarbon;diabetes;endocrine system;heterogeneity;meta-analysis;PBDE;public health;risk factor;taxonomy;Article;clinical feature;disease association;exposure;female;human;incidence;pregnancy diabetes mellitus;systematic review;time of flight mass spectrometry;ultra performance liquid chromatography;meta analysis;pollutant;pregnancy",NA,NA
rayyan-1268391085,Effects of exposure to per- and polyfluoroalkyl substances on vaccine antibodies: A systematic review and meta-analysis based on epidemiological studies,2022,NA,NA,Environmental Pollution,02697491 (ISSN),306,NA,,"Zhang, X. and Xue, L. and Deji, Z. and Wang, X. and Liu, P. and Lu, J. and Zhou, R. and Huang, Z.",https://www.scopus.com/inward/record.uri?eid=2-s2.0-85130165031&doi=10.1016%2fj.envpol.2022.119442&partnerID=40&md5=aea6e55a71f89e21ac9f7d49f400c5a6,English,Elsevier Ltd,"[""Department of Preventive Medicine, School of Public Health, Wuhan University, Wuhan, 430071, China"", ""Department of Obstetrics and Gynecology, Zhongnan Hospital of Wuhan University, Wuhan, 430071, China""]","Vaccines are essential for children to defend against infection. Per- and polyfluoroalkyl substances (PFAS) are emerging contaminants with the characteristics of persistence and bioaccumulation. PFAS exposure can affect the function of the nervous, endocrine, and immune system of animals and humans. We aimed to conduct a systematic review and meta-analysis of the epidemiological studies investigating potential relationships between PFAS exposure and vaccine antibody levels, and assessed whether PFAS would affect vaccine response in healthy children. A literature search was conducted in PubMed, Web of Science, and Scopus databases up to February 2022. We chose studies that measured serum vaccines antibodies and PFAS concentrations of the participants. Essential information, including mean difference of percentage change, regression coefficient, odds ratio, Spearman correlation coefficient, and 95% confidence intervals, were extracted from the selected studies to conduct descriptive analysis and meta-analysis where appropriate. The qualities of these studies were evaluated as well. Finally, nine epidemiological studies about children met our inclusion criteria. A high degree of heterogeneity is observed in terms of breastfeeding time, confounder control, and detection method. Exposure to perfluorooctanoic acid and perfluorohexane sulfonic acid is negatively associated with tetanus antibody level in children without heterogeneity by Cochran's Q test (p = 0.26; p = 0.55), and exposure to perfluorohexane sulfonate is negatively associated with tetanus antibody level but with heterogeneity (p = 0.04). This comprehensive review suggests that PFAS can have adverse health effects on children by hindering the production of vaccine antibodies. There are some consistent and negative associations between children exposure to certain PFAS and tetanus antibody level. The association of the other four vaccines (measles, rubella, mumps, and influenza) with PFAS remains uncertain, because very few studies are available. Further studies are needed to validate the possible associations.  2022 Elsevier Ltd","Export Date: 08 April 2024; Cited By: 18; Correspondence Address: Z. Huang; Department of Preventive Medicine, School of Public Health, Wuhan University, Wuhan, 430071, China; email: zzhuang@whu.edu.cn; CODEN: ENPOE | RAYYAN-INCLUSION: {""Lorenzo""=>""Included"", ""Kyle ""=>""Included""}",10.1016/j.envpol.2022.119442,"Environmental exposure;Epidemiological studies;Per- and polyfluoroalkyl substances;Vaccine antibody;Alkanesulfonic Acids;Antibodies, Viral;Environmental Pollutants;Epidemiologic Studies;Fluorocarbons;Humans;Tetanus;Biochemistry;Quality control;Vaccines;antibody;diphtheria vaccine;influenza vaccine;measles vaccine;mumps vaccine;perfluorohexanesulfonic acid;perfluorooctanesulfonic acid;rubella vaccine;tetanus antibody;tetanus toxoid;alkanesulfonic acid;fluorocarbon;virus antibody;Emerging contaminant;Literature search;Meta-analysis;Per- and polyfluoroalkyl substance;Polyfluoroalkyl substances;Systematic Review;Web of Science;bioaccumulation;chemical pollutant;disease control;endocrine system;epidemiology;immune system;literature review;meta-analysis;model validation;pollution effect;vaccination;vaccine;antibody blood level;antibody production;breast feeding;confounding variable;correlation coefficient;drug response;environmental exposure;Haemophilus influenzae type b;human;influenza;measles;mumps;Review;rubella;systematic review;treatment outcome;meta analysis;pollutant;tetanus;toxicity;Antibodies;Vaccination",NA,NA
rayyan-1268391101,Metabolic syndrome and pesticides: A systematic review and meta-analysis,2022,NA,NA,Environmental Pollution,02697491 (ISSN),305,NA,,"Lamat, H. and Sauvant-Rochat, M.-P. and Tauveron, I. and Bagheri, R. and Ugbolue, U.C. and Maqdasi, S. and Navel, V. and Dutheil, F.",https://www.scopus.com/inward/record.uri?eid=2-s2.0-85129092024&doi=10.1016%2fj.envpol.2022.119288&partnerID=40&md5=2e45a8e31e562d79f4537d2e17d105e2,English,Elsevier Ltd,"[""Universit Clermont Auvergne, University Hospital of ClermontFerrand, CHU ClermontFerrand, Endocrinology-diabetology-nutrition, Clermont-Ferrand, 63000, France"", ""Universit Clermont Auvergne, CNRS, GReD, Inserm, University Hospital of Clermont-Ferrand, CHU Clermont-Ferrand, Endocrinology, Clermont-Ferrand, France"", ""Universit Clermont Auvergne, Clermont Auvergne INP, CNRS, Institut Pascal, ClermontFerrand, F-63000, France"", ""University of Isfahan, Exercise Physiology, Isfahan, Iran"", ""University of the West of Scotland, Health and Life Sciences, South Lanarkshire, Scotland, UK, United Kingdom"", ""Universit Clermont Auvergne, CNRS, INSERM, GReD, CHU Clermont-Ferrand, University Hospital of Clermont-Ferrand, Ophthalmology, Clermont-Ferrand, France"", ""Universit Clermont Auvergne, CNRS, LaPSCo, Physiological and Psychosocial Stress, University Hospital of ClermontFerrand, CHU ClermontFerrand, Occupational and Environmental Medicine, WittyFit, ClermontFerrand, F63000, France""]","The relation between pesticides exposure and metabolic syndrome (MetS) has not been clearly identified. Performing a systematic review and meta-analysis, PubMed, Cochrane Library, Embase, and ScienceDirect were searched for studies reporting the risk of MetS following pesticides exposure and their contaminants. We included 12 studies for a total of 6789 participants, in which 1981 (29.1%) had a MetS. Overall exposure to pesticides and their contaminants increased the risk of MetS by 30% (95CI 22%37%). Overall organochlorine increased the risk of MetS by 23% (1432%), as well as for most types of organochlorines: hexachlorocyclohexane increased the risk by 53% (2878%), hexachlorobenzene by 40% (0.0180%), dichlorodiphenyldichloroethylene by 22% (934%), dichlorodiphenyltrichloroethane by 28% (550%), oxychlordane by 24% (147%), and transnonchlor by 35% (1952%). Sensitivity analyses confirmed that overall exposure to pesticides and their contaminants increased the risk by 46% (3556%) using crude data or by 19% (1029%) using fully-adjusted model. The risk for overall pesticides and types of pesticides was also significant with crude data but only for hexachlorocyclohexane (36% risk increase, 1755%) and transnonchlor (25% risk increase, 348%) with fully-adjusted models. Metaregressions demonstrated that hexachlorocyclohexane increased the risk of MetS in comparison to most other pesticides. The risk increased for more recent periods (Coefficient = 0.28, 95CI 0.20 to 0.37, by year). We demonstrated an inverse relationship with body mass index and male gender. In conclusion, pesticides exposure is a major risk factor for MetS. Besides organochlorine exposure, data are lacking for other types of pesticides. The risk increased with time, reflecting a probable increase of the use of pesticides worldwide. The inverse relationship with body mass index may signify a stockage of pesticides and contaminants in fat tissue.  2022 Elsevier Ltd","Export Date: 08 April 2024; Cited By: 13; Correspondence Address: F. Dutheil; University Hospital of Clermont-Ferrand, CHU Clermont-Ferrand, France; email: frederic.dutheil@uca.fr; CODEN: ENPOE | RAYYAN-INCLUSION: {""Lorenzo""=>""Included"", ""Kyle ""=>""Included""}",10.1016/j.envpol.2022.119288,"Exposure;Meta-analysis;Meta-regression;Metabolic syndrome;Pesticide;Public health;Systemic review;DDT;Hexachlorocyclohexane;Humans;Hydrocarbons, Chlorinated;Male;Metabolic Syndrome;Pesticides;Metabolism;Risk assessment;Sensitivity analysis;1,1 dichloro 2,2 bis(4 chlorophenyl)ethylene;chlorphenotane;hexachlorobenzene;hexachlorocyclohexane;organochlorine pesticide;oxychlordane;transnonchlor;unclassified drug;chlorinated hydrocarbon;pesticide;Hexachlorocyclohexanes;Inverse relationship;Metabolic syndromes;Organochlorines;Pesticides exposures;Systematic Review;body mass;health risk;meta-analysis;metabolism;public health;regression analysis;sensitivity analysis;adipose tissue;environmental exposure;factual database;gender;human;metabolic syndrome X;nonhuman;Review;risk assessment;risk factor;systematic review;male;meta analysis;Contamination",NA,NA
rayyan-1268391118,Association between per- and polyfluoroalkyl substances and risk of gestational diabetes mellitus,2022,NA,NA,International Journal of Hygiene and Environmental Health,14384639 (ISSN),240,NA,,"Wang, J. and Zhang, J. and Fan, Y. and Li, Z. and Tao, C. and Yan, W. and Niu, R. and Huang, Y. and Xu, Q. and Wang, X. and Xu, Q. and Han, L. and Lu, C.",https://www.scopus.com/inward/record.uri?eid=2-s2.0-85121217025&doi=10.1016%2fj.ijheh.2021.113904&partnerID=40&md5=028f60cc31e19837b0c79ecfb88f2921,English,Elsevier GmbH,"[""State Key Laboratory of Reproductive Medicine, Center for Global Health, School of Public Health, Nanjing Medical University, Nanjing, 211166, China"", ""Key Laboratory of Modern Toxicology of Ministry of Education, School of Public Health, Nanjing Medical University, Nanjing, 211166, China"", ""Department of Toxicology, School of Public Health, Medical College of Soochow University, Jiangsu Suzhou, 215123, China"", ""Chinese Research Academy of Environmental Sciences, Beijing, 100012, China"", ""Department of Obstetrics, Huai-An First Affiliated Hospital, Nanjing Medical University, Nanjing, 210029, China""]","Background: Existing evidence suggests that perfluoroalkyl and polyfluoroalkyl substances (PFASs) exposure might contribute to the incidence of gestational diabetes mellitus (GDM). This study aimed to perform a meta-analysis to identify the association between PFAS and the risk of GDM. Methods: We systematically searched PubMed, Ovid, Cochrane Library, and Web of Science databases for appropriate articles about the association between PFASs exposure and the risk of GDM before September 28, 2020. Odds ratios (OR) with 95% confidence intervals (CIs) were summarized by Stata 16.0 through fixed effect models according to heterogeneity. We also carried out subgroup analyses by geographic location, blood sampling time of subjects, method of chemical analysis, study design, sample size, and sampling year. In addition, a sensitivity analysis was conducted to explore the robustness of the results. Results: A total of eight studies involving 5654 pregnant women were included in the meta-analysis. Perfluorooctanoic acid (PFOA) exposure was positively and significantly associated with the risk of GDM (OR = 1.27, 95% CI: 1.021.59). Exposure to other types of PFASs such as perfluorooctane sulfonate (PFOS), perfluorohexane sulfonate (PFHxS), perfluorononanoic acid (PFNA) was not statistically significantly associated with the risk of GDM with the pooled effect estimates of 0.97 (95% CI: 0.861.09), 1.03 (95% CI: 0.861.24), and 0.80 (95% CI: 0.551.16) respectively. Conclusion: We conducted a meta-analysis to investigate the association between PFASs exposure and GDM and found that PFOA concentration was significantly associated with a higher risk of GDM, which is of great significance for the prevention and control of GDM in public health. Further studies are needed in order to establish causality and clarify the potential mechanism.  2021","Export Date: 08 April 2024; Cited By: 14; Correspondence Address: C. Lu; State Key Laboratory of Reproductive Medicine, Center for Global Health, Nanjing Medical University, Nanjing, 211166, China; email: chunchenglu@njmu.edu.cn; L. Han; Department of Obstetrics, Huai-An First Affiliated Hospital, Nanjing Medical University, Nanjing, 210029, China; email: hanli61911@126.com; CODEN: IJEHF | RAYYAN-INCLUSION: {""Lorenzo""=>""Included"", ""Kyle ""=>""Included""}",10.1016/j.ijheh.2021.113904,"Gestational diabetes mellitus;Meta-analysis;Perfluoroalkyl and polyfluoroalkyl substances;Alkanesulfonic Acids;Cohort Studies;Diabetes, Gestational;Environmental Pollutants;Female;Fluorocarbons;Humans;Odds Ratio;Pregnancy;alkanesulfonic acid;fluorocarbon;cohort analysis;female;human;meta analysis;odds ratio;pollutant;pregnancy;pregnancy diabetes mellitus",NA,NA
rayyan-1268391120,Exposure to per-and Polyfluoroalkyl Substances and Markers of Liver Injury: A Systematic Review and Meta-Analysis,2022,NA,NA,Environmental Health Perspectives,00916765 (ISSN),130,4,,"Costello, E. and Rock, S. and Stratakis, N. and Eckel, S.P. and Walker, D.I. and Valvi, D. and Cserbik, D. and Jenkins, T. and Xanthakos, S.A. and Kohli, R. and Sisley, S. and Vasiliou, V. and La Merrill, M.A. and Rosen, H. and Conti, D.V. and McConnell, R. and Chatzi, L.",https://www.scopus.com/inward/record.uri?eid=2-s2.0-85129780093&doi=10.1289%2fEHP10092&partnerID=40&md5=0d174388360726810f90eee1067626c7,English,"Public Health Services, US Dept of Health and Human Services","[""Department of Population and Public Health Sciences, Keck School of Medicine, University of Southern California, Los Angeles, CA, United States"", ""Department of Environmental Medicine and Public Health, Icahn School of Medicine at Mount Sinai, New York, NY, United States"", ""Barcelona Institute for Global Health, Barcelona, Spain"", ""Division of Pediatric General and Thoracic Surgery, Cincinnati Childrens Hospital Medical Center, Cincinnati, OH, United States"", ""Division of Gastroenterology, Hepatology and Nutrition, Cincinnati Childrens Hospital Medical Center, Department of Pediatrics, University of Cincinnati College of Medicine, Cincinnati, OH, United States"", ""Division of Gastroenterology, Hepatology and Nutrition, Childrens Hospital Los Angeles, Los Angeles, CA, United States"", ""Department of Pediatrics, Baylor College of Medicine, Houston, TX, United States"", ""Department of Environmental Health Sciences, Yale School of Public Health, New Haven, CT, United States"", ""Department of Environmental Toxicology, University of California, Davis, Davis, CA, United States"", ""Department of Medicine, Keck School of Medicine, University of Southern California, Los Angeles, CA, United States""]","BACKGROUND: Experimental evidence indicates that exposure to certain pollutants is associated with liver damage. Per-and polyfluoroalkyl substances (PFAS) are persistent synthetic chemicals widely used in industry and consumer products and bioaccumulate in food webs and human tissues, such as the liver. OBJECTIVE: The objective of this study was to conduct a systematic review of the literature and meta-analysis evaluating PFAS exposure and evidence of liver injury from rodent and epidemiological studies. METHODS: PubMed and Embase were searched for all studies from earliest available indexing year through 1 December 2021 using keywords corresponding to PFAS exposure and liver injury. For data synthesis, results were limited to studies in humans and rodents assessing the following indicators of liver injury: serum alanine aminotransferase (ALT), nonalcoholic fatty liver disease, nonalcoholic steatohepatitis, or steatosis. For human studies, at least three observational studies per PFAS were used to conduct a weighted z-score meta-analysis to determine the direction and significance of associations. For rodent studies, data were synthesized to qualitatively summarize the direction and significance of effect. RESULTS: Our search yielded 85 rodent studies and 24 epidemiological studies, primarily of people from the United States. Studies focused primarily on legacy PFAS: perfluorooctanoic acid (PFOA), perfluorooctanesulfonic acid (PFOS), perfluorononanoic acid (PFNA), and perfluorohexanesulfonic acid. Meta-analyses of human studies revealed that higher ALT levels were associated with exposure to PFOA (z-score = 6.20, p < 0:001), PFOS (z-score = 3.55, p < 0:001), and PFNA (z-score = 2.27, p = 0:023). PFOA exposure was also associated with higher aspartate aminotransferase and gamma-glutamyl transferase levels in humans. In rodents, PFAS exposures consistently resulted in higher ALT levels and steatosis. CONCLUSION: There is consistent evidence for PFAS hepatotoxicity from rodent studies, supported by associations of PFAS and markers of liver function in observational human studies. This review identifies a need for additional research evaluating next-generation PFAS, mixtures, and early life exposures. https://doi.org/10.1289/EHP10092.  2022, Public Health Services, US Dept of Health and Human Services. All rights reserved.","Export Date: 08 April 2024; Cited By: 121; Correspondence Address: E. Costello; Department of Population and Public Health Sciences, Keck School of Medicine, University of Southern California, Los Angeles, United States; email: eecostel@usc.edu | RAYYAN-INCLUSION: {""Lorenzo""=>""Included"", ""Kyle ""=>""Included""}",10.1289/EHP10092,Biomarkers;Environmental Pollutants;Fluorocarbons;Humans;Non-alcoholic Fatty Liver Disease;United States;alanine aminotransferase;alkaline phosphatase;aspartate aminotransferase;bilirubin;cytokeratin 18;gamma glutamyltransferase;perfluorodecanoic acid;perfluorohexanesulfonic acid;perfluorononanoic acid;perfluorooctanesulfonic acid;perfluorooctanoic acid;biological marker;fluorocarbon;alanine aminotransferase blood level;aspartate aminotransferase blood level;body weight;gamma glutamyl transferase blood level;gene expression;human;liver fibrosis;liver function;liver injury;liver weight;meta analysis;nonalcoholic fatty liver;nonalcoholic steatohepatitis;nonhuman;outcome assessment;Review;systematic review;pollutant;Liver,NA,NA
rayyan-1268391139,Associations between Polyfluoroalkyl Substances Exposure and Breast Cancer: A Meta-Analysis,2022,NA,NA,Toxics,23056304 (ISSN),10,6,,"Jiang, H. and Liu, H. and Liu, G. and Yu, J. and Liu, N. and Jin, Y. and Bi, Y. and Wang, H.",https://www.scopus.com/inward/record.uri?eid=2-s2.0-85132301025&doi=10.3390%2ftoxics10060318&partnerID=40&md5=c72d2f8cc770895d2c6674fc56f7a872,English,MDPI,"School of Public Health, Wuhan University, Wuhan, 430071, China","Polyfluoroalkyl substances (PFASs) are persistent pollutants that may cause breast cancer. However, associations between exposure to PFASs and the risk of breast cancer are controversial. We retrieved studies on the association between PFASsperfluorooctanoic acid (PFOA), perfluo-rononanoic acid (PFNA), perfluorohexane sulfonic acid (PFHxS), and perfluorooctane sulfonic acid (PFOS)and breast cancer risk in women from PubMed, Embase, and the Web of Science. The pooled odds ratios (ORs) or relative risks (RRs) and their 95% confidence intervals (CIs) were ex-tracted or calculated from provided data. Moreover, subgroup and metaregression analyses were performed to distinguish the potential sources of heterogeneity between studies. Lastly, eight orig-inal studies were included in the meta-analysis. PFOA and PFHxS were positively correlated with breast cancer risk, and the pooled ORs (and 95% CIs) were 1.32 (1.19 and 1.46) and 1.79 (1.51 and 2.11), respectively. PFNA was negatively correlated with breast cancer risk and the pooled OR (and 95% CIs) was 0.76 (0.6 and 0.96), and PFOS was shown to have no correlation with breast cancer risk and the pooled OR (and 95% CIs) was 1.01 (0.87 and 1.17). All results were merged in a random-effects model with significant heterogeneities (I2 > 90%, p < 0.001). The results demonstrated that PFASs might be potential risk factors for breast cancer, and the compounds in low exposure levels could have a more harmful impact on human health.  2022 by the authors. Licensee MDPI, Basel, Switzerland.","Export Date: 08 April 2024; Cited By: 2; Correspondence Address: H. Wang; School of Public Health, Wuhan University, Wuhan, 430071, China; email: wanghong@whu.edu.cn | RAYYAN-INCLUSION: {""Lorenzo""=>""Included"", ""Kyle ""=>""Included""}",10.3390/toxics10060318,breast cancer;meta-analysis;pollutant;polyfluoroalkyl substance;perfluorohexanesulfonic acid;perfluorononanoic acid;perfluorooctanesulfonic acid;perfluorooctanoic acid;cancer risk;disease association;environmental exposure;human;Review;risk factor;systematic review;Breast Neoplasms,NA,NA
