key,title,year,month,day,journal,issn,volume,issue,pages,authors,url,language,publisher,location,abstract,notes,doi,keywords,pubmed_id,pmc_id,title2
rayyan-1259295007,Barriers and Promotors to Health Service Utilization for Pelvic Floor Disorders in the United States: Systematic Review and Meta-analysis of Qualitative and Quantitative Studies,2022,12,NA,OBSTETRICAL \& GYNECOLOGICAL SURVEY,0029-7828,77,12,731-733,"Mou, Tsung and Gonzalez, Javier and Gupta, Ankita and O'Shea, Michele and Thibault, Mary Duarte and Gray, Elizabeth L. L. and Beestrum, Molly and Brown, Oluwateniola and Cichowski, Sara",,,,,"Pelvic floor disorders (PFDs), such as pelvic organ prolapse (POP), anal incontinence (AI), and lower urinary tract symptoms (LUTSs), affect approximately 1 in 4 women in the United States. Many women endure PFD symptoms without seeking care. The Andersen's health behavior model explains health service utilization (HSU) using 4 domains: (1) individual needs for care, (2) resources or enabling factors, (3) predisposing factors, and (4) macrostructural/contextual factors. This study aims to apply this model to PFDs to determine the rate of HSUs in American women experiencing PFDs. The secondary objective was to examine HSU behavior using a variation of Andersen's model: the authors limited outcome variables to that of accessing PFD health services by any health care provider. As the normal Andersen's health behavior model covers broad personal health practices and general health behavior, this modification allowed for increased precision of individual predictors and relevance to urogynecology. Following PRISMA (Preferred Reporting Items for Systematic Reviews and Meta-analyses) guidelines, the authors conducted a systematic review of literature on PubMed, using search terms relevant to PFDs (in addition to disparities in care access). Included were studies of community-dwelling PFD symptomatic women living in the United States and quantitative and qualitative studies with primary and/or secondary aims addressing care-seeking or HSU behavior. For this study, PFDs were defined as AI, LUTSs, and POP. Extracted data were as follows: first author's last name, study aim, year of publication, study population geographic location, study participant demographics, PFD types, insurance, number of care-seekers and/or non-care-seekers, participant age, race/ethnicity, education, income, employment, body mass index, general health status, language used in study, symptoms, and other barriers and/or promotors identified. Overall, 44 publications were found that met the criteria of the study. Of these, 36 were quantitative, 5 were qualitative, and 3 were mixed-methods studies. The predominant focus of these studies was LUTSs (33/44 studies), whereas only 2 were on POP, 5 onmultiple PFDs, and 4 onAI. More than half were publishedmore than a decade ago (25/44), and themajority were based on self-reporting to national surveys. Women with symptomatic PFDs exhibited a 37\% pooled prevalence of HSU, with determinants identified across the first 3 domains in the model only (macrostructural domains associated with HSU were not identified). For the first domain, quantitative studies demonstrated that PFD symptom severity and duration and preexisting depression were individual care needs associated with greater HSU behavior. Consistent with the quantitative data available in this study, qualitative data also demonstrated that facilitators of HSU were (1) longer symptom duration and (2) negative impact of PFD on quality of life. For the resources domain, established primary or secondary care and social support/networks increased HSU behaviors, but (oddly) higher income and employment were barriers to care. Of note, home remedy utilization was identified as a barrier to HSU in this category (taking of herbal supplements, use of diapers, and other self-management strategies). Predisposing factors noted to increase HSU in this study were age older than 50 years. Minority women were not well represented in this analysis, but notably, Asian women were significantly less likely to demonstrate HSU related to PFD. Qualitatively, there were no differences in socioeconomic status of women who did or did not show HSU, but the most common facilitator was awareness of PFD treatments, and common barriers included misinformation and normalization of pelvic floor symptoms. Limitations of this study include the possibility of missed publications with relevance (such as articles involving interstitial cystitis, sexual dysfunction, birth trauma, and others, as they are important aspects of PFDs). However, the team focused on studies related to common PFDs and their HSU, as opposed to peripheral analyses or pelvic floor conditions. Second, the study may be limited by using counts of themes and numbers of reporting studies in the overall qualitative analysis. Finally, significant heterogeneity in the studies indicates caution should be used in interpreting the operating room and pooled HSU rate for each identified determinant. The study indicates that designing inclusive interventions, building upon previous research frameworks, and addressing multilayered factors are all required for improving care-seeking rates of women with PFDs. To mitigate the glaring inequity in the United States of access to pelvic floor care, the authors recommend research focused on HSU for patients with POP or AI, implementation of multifaceted interventions, and investigations into macrostructural factors affecting HSU.",,10.1097/OGX.0000000000001115,United States;Pelvic Floor;Health Services,NA,,barriers and promotors to health service utilization for pelvic floor disorders in the united states systematic review and metaanalysis of qualitative and quantitative studies
rayyan-1259295008,Untargeted metabolomic analysis of pregnant women exposure to perfluorooctanoic acid at different degrees,2023,3,NA,FRONTIERS OF ENVIRONMENTAL SCIENCE \& ENGINEERING,2095-2201,17,3,,"Yang, Kaige and Zhang, Zhouyi and Hu, Kangdie and Peng, Bo and Wang, Weiwei and Liang, Hong and Yan, Chao and Wu, Mingyuan and Wang, Yan",,,,,"Perfluorooctanoic acid (PFOA) is a novel type of persistent synthetic organic pollutant, and its exposure on pregnant women can cause some adverse effects, such as pregnancy-induced hypertension, gestational diabetes mellitus, and preeclampsia. Therefore, understanding the metabolic changes caused by PFOA exposure is of great significance to protect pregnant women from its adverse effects. In this study, the metabolomes from the urine samples of pregnant women exposure to PFOA at different degrees were analyzed by GC-MS and LC-MS. The samples in different groups were distinguished and the differential metabolites were screened based on the VIP value, FC, and P-value of each comparison group through multivariate statistical analysis. The pathways related to differential metabolites were searched to reveal the effects of PFOA exposure on metabolic changes in pregnant women at different degrees. Finally, the ROC of differential metabolites was performed, and the differential metabolites with large area under the curve (AUC) values were selected and compared to identify the mutually differential metabolites. Meanwhile, these metabolites were fitted with a multivariable to explore if they could be used to distinguish different groups. The quantitative comparison of mutually differential metabolites revealed that the levels of L-cysteine, glycine, and 5-aminovaleric acid were positively correlated with the degree of PFOA exposure, indicating that different degrees of PFOA exposure could affect the synthesis or degradation of GSH and change the metabolism of oral or intestinal microbiota. Additionally, they may cause oxidative stress and abnormal fat metabolism in pregnant women. (C) Higher Education Press 2023",,10.1007/s11783-023-1628-x,,NA,,untargeted metabolomic analysis of pregnant women exposure to perfluorooctanoic acid at different degrees
rayyan-1259295009,Dual-screw versus single-screw cephalomedullary nails for intertrochanteric femoral fractures: a systematic review and meta-analysis,2023,8,NA,JOURNAL OF ORTHOPAEDIC SURGERY AND RESEARCH,1749-799X,18,1,,"Yang, Fan and Li, Xiafei and Zhao, Lei and Yang, Qi",,,,,"BackgroundInternal fixation with cephalomedullary nails has been widely used in the treatment of intertrochanteric femoral fractures (IFF). Yet, the difference in efficacy and safety between the commonly used integrated dual-screw cephalomedullary nail (InterTAN) and single-screw cephalomedullary nail remains inconclusive. Thus we performed the present systematic review and meta-analysis.MethodsRandomized controlled trials (RCTs) or observational studies comparing InterTAN with proximal femoral nail anti-rotation (PFNA), the Asian PFNA (PFNA-II), or the Gamma3 nail in treating IFF were searched on PubMed, EMBASE, Web of Science and Cochrane Library from inception to April 30, 2023. The differences in perioperative parameters and clinical and radiological outcomes were evaluated by mean difference (MD) with 95\% confidence interval (95\%CI). The risks of various complications and mortality were assessed by risk ratio (RR) with 95\%CI.ResultsTwenty-three studies comprising 3566 patients were included. Compared with single-screw cephalomedullary nails (PFNA/PFNA-II, Gamma3), InterTAN conferred significantly reduced risk of implant failures (RR = 0.37, 95\%CI 0.26 to 0.51, P < 0.001), hip and thigh pain (RR = 0.70, 95\%CI 0.55 to 0.90, P = 0.006) and all-cause revision/reoperation (RR = 0.38, 95\%CI 0.26 to 0.57, P < 0.001). Moreover, patients treated with InterTAN had significantly higher 1-year Harris Hip Score (MD = 0.82, 95\%CI 0.20-1.44, P = 0.010) and shorter time to union/healing (MD = - 0.66 days, 95\%CI - 1.16 to - 0.16, P = 0.009). Femoral neck shortening, time to full bearing, and incidences of non-union, infection, deep venous thrombosis, and mortality were comparable between both groups.ConclusionsThe integrated dual-screw InterTAN construct has superior performance in reducing risks of complications and improving clinical and functional outcomes in the treatment of IFF. More well-designed, high-quality RCTs are warranted to confirm these findings.",,10.1186/s13018-023-04103-x,Femoral Fractures;Nails,NA,,dualscrew versus singlescrew cephalomedullary nails for intertrochanteric femoral fractures a systematic review and metaanalysis
rayyan-1259295010,Distribution characteristics and transformation mechanism of per- and polyfluoroalkyl substances in drinking water sources: A review,2024,3,NA,SCIENCE OF THE TOTAL ENVIRONMENT,0048-9697,916,NA,,"Zhu, Heying and Xia, Yijing and Zhang, Yifeng and Kang, Ying and Ding, Yangcheng and Chen, Ruya and Feng, Huajun",,,,,"Per- and polyfluoroalkyl substances (PFASs) have raised significant concerns within the realm of drinking water due to their widespread presence in various water sources. This prevalence poses potential risks to human health, ecosystems, and the safety of drinking water. However, there is currently a lack of comprehensive reviews that systematically categorize the distribution characteristics and transformation mechanisms of PFASs in drinking water sources. This review aims to address this gap by concentrating on the specific sources of PFASs contamination in Chinese drinking water supplies. It seeks to elucidate the migration and transformation processes of PFASs within each source, summarize the distribution patterns of PFASs in surface and subsurface drinking water sources, and analyze how PFASs molecular structure, solubility, and sediment physicochemical parameters influence their presence in both the water phase and sediment. Furthermore, this review assesses two natural pathways for PFASs degradation, namely photolysis and biodegradation. It places particular emphasis on understanding the degradation mechanisms and the factors that affect the breakdown of PFASs by microorganisms. The ultimate goal is to provide valuable insights for the prevention and control of PFAS contamination and the assurance of drinking water quality.",,10.1016/j.scitotenv.2023.169566,Drinking,NA,,distribution characteristics and transformation mechanism of per and polyfluoroalkyl substances in drinking water sources a review
rayyan-1259295011,Plastic microfibers as a risk factor for the health of aquatic organisms: A bibliometric and systematic review of plastic pandemic,2023,4,NA,SCIENCE OF THE TOTAL ENVIRONMENT,0048-9697,870,NA,,"Qualhato, Gabriel and Vieira, Lucelia Goncalves and Oliveira, Miguel and Rocha, Thiago Lopes",,,,,"Plastic microfibers (PMFs) are emerging pollutants widely distributed in the environment. In the early 2020s, the need for personal protection due to the COVID-19 pandemic led to increased consumption of plastic materials (e.g., facemasks and gloves) and ultimately to increased plastic pollution, especially by PMFs. The PMFs present in the environment may be released in this form (primary particles) or in larger materials, that will release them as a result of environmental conditions. Although a considerable number of studies have been addressing the effects of microplastics, most of them studied round particles, with fewer studies focusing on PMFs. Thus, the current study aimed to summarize and critically discuss the available data concerning the ecotoxicological impact of PMFs on aquatic organisms. Aquatic organisms exposed to PMFs showed accumulation, mainly in the digestive tract, and several toxic effects, such as DNA damage, physiological alterations, digestive damage and even mortality, suggesting that PMFs can pose a risk for the health of aquatic organisms. The PMFs induced toxicity to aquatic invertebrate and vertebrate organisms depends on size, shape, chemical association and composition of fibers. Regarding other size range (nm) of plastic fibers, the literature review highlighted a knowledge gap in terms of the effects of plastic nanofibers on aquatic organisms. There is a knowledge gap in terms of the interaction and modes of action of PMFs associated with other pollutants. In addition, studies addressing effects at different trophic levels as well as the use of other biological models should be considered. Overall, research gaps and recommendations for future research and trends considering the environmental impact of the COVID-19 pandemic are presented.",,10.1016/j.scitotenv.2023.161949,Bibliometrics;Risk Factors,NA,,plastic microfibers as a risk factor for the health of aquatic organisms a bibliometric and systematic review of plastic pandemic
rayyan-1259295012,"Wastewater Hydroponics for Pollutant Removal and Food Production: Principles, Progress and Future Outlook",2023,7,NA,WATER,,15,14,,"Mai, Chao and Mojiri, Amin and Palanisami, Swaminathan and Altaee, Ali and Huang, Yuhan and Zhou, John L. L.",,,,,"As the global population reaches eight billion, large quantities of wastewater (domestic, industrial, livestock) need to be treated in an efficient, green, and environmentally friendly manner. Wastewater hydroponics technology (HP) can efficiently remove various pollutants (conventional and emerging pollutants, heavy metals, and microorganisms) and create economic benefits. This paper aims to systematically review the principles, applications, and limitations of wastewater hydroponics technology in the context of pollution and nutrient removal. Unlike constructed wetlands, wastewater hydroponics has been proven to be effective in removing pollutants through small-scale in situ restoration. For instance, the average removal of COD, total nitrogen (TN), total phosphorus (TP), copper (Cu), and zinc (Zn) was more than 70\%, 60\%, 80\%, 64.2\%, and 49.5\%, respectively. However, HP technology still has the disadvantages of high energy consumption, complex control parameters, and low public acceptance of using wastewater for planting crops. Therefore, further research is needed to reduce system energy consumption. In addition, hybrid technologies, such as two-stage hydroponics that use aquatic plants (algae or aquatic floating weeds) to recycle pollutant-containing wastewater nutrients for hydroponics, should be further developed.",,10.3390/w15142614,Waste Water,NA,,wastewater hydroponics for pollutant removal and food production principles progress and future outlook
rayyan-1259295013,Metal-Organic Framework-Based Composites for the Adsorption Removal of Per- and Polyfluoroalkyl Substances from Water,2024,2,NA,LANGMUIR,0743-7463,40,6,2815-2829,"Li, Shuang and Ma, Jiping and Cheng, Jiawen and Wu, Gege and Wang, Shasha and Huang, Chaonan and Li, Jinhua and Chen, Lingxin",,,,,"The increasing health risks posed by per- and polyfluoroalkyl substances (PFASs) in the environment highlight the importance of implementing effective removal techniques. Conventional wastewater treatment processes are inadequate for removing persistent organic pollutants. Recent studies have increasingly demonstrated that metal-organic frameworks (MOFs) are capable of removing PFASs from water through adsorption techniques. However, there is still constructive discussion on the potential of MOFs in adsorbing and removing PFASs for large-scale engineering applications. This review systematically investigates the use of MOFs as adsorbents for the removal of PFAS in water treatment. This primarily involved a comprehensive analysis of existing literature to understand the adsorption mechanisms of MOFs and to identify factors that enhance their efficiency in removing PFASs. We also explore the critical aspects of regeneration and stability of MOFs, assessing their reusability and long-term performance, which are essential for large-scale water treatment applications. Finally, our study highlights the challenges of removing PFASs using MOFs. Especially, the efficient removal of short-chain PFASs with hydrophilicity is a major challenge, while medium- to long-chain PFASs are frequently susceptible to being captured from water by MOFs through multiple synergistic effects. The ion-exchange force may be the key to solving this difficulty, but its susceptibility to ion interference in water needs to be addressed in practical applications. We hope that this review can provide valuable insights into the effective removal and adsorption mechanisms of PFASs as well as advance the sustainable utilization of MOFs in the field of water treatment, thereby presenting a novel perspective.",,10.1021/acs.langmuir.3c02939,Adsorption,NA,,metalorganic frameworkbased composites for the adsorption removal of per and polyfluoroalkyl substances from water
rayyan-1259295014,Investigation of dichlorodiphenyltrichloroethane (DDT) on xenobiotic enzyme disruption and metabolomic bile acid biosynthesis in DDT-sprayed areas using wild rats,2023,2,NA,JOURNAL OF VETERINARY MEDICAL SCIENCE,0916-7250,85,2,236-243,"Motohira, Kodai and Yohannes, Yared Beyene and Ikenaka, Yoshinori and Eguchi, Akifumi and Nakayama, Shouta M. M. and Wepener, Victor and Smit, Nico J. and Vuren, Johan H. J. V. A. N. and Ishizuka, Mayumi",,,,,". Dichlorodiphenyltrichloroethane (DDT) is an organochlorine insecticide used worldwide. Several studies have reported the toxic effects of DDT and its metabolites on steroid hormone biosynthesis; however, its environmental effects are not well understood. This study examined wild rats collected in DDT-sprayed areas of South Africa and quantified plasma metabolites using liquid chromatography quadrupole time-of-flight mass spectrometry (LC-Q-TOF-MS). Fold change analysis of the metabolome revealed the effect of DDT on bile acid biosynthesis. Gene expression of the related enzyme in rat liver samples was also quantified. Significant association was found between DDT and gene expression levels related to constitutive androstane receptor mediated enzymes, such as Cyp2b1 in rat livers. However, our results could not fully demonstrate that enzymes related to bile acid biosynthesis were strongly affected by DDT. The correlation between DDT concentration and gene expression involved in steroid hormone synthesis in testis was also evaluated; however, no significant correlation was found. The disturbance of metabolic enzymes occurred in rat liver in the target area. Our results suggest that DDT exposure affects gene expression in wild rats living in DDT-sprayed areas. Therefore, there is a need for DDT toxicity evaluation in mammals living in DDT-sprayed areas. We could not find an effective biomarker that could reflect the mechanism of DDT exposure; however, this approach can provide new insights for future research to evaluate DDT effects in sprayed areas.",,10.1292/jvms.22-0490,Rats,NA,,investigation of dichlorodiphenyltrichloroethane ddt on xenobiotic enzyme disruption and metabolomic bile acid biosynthesis in ddtsprayed areas using wild rats
rayyan-1259295015,Transcriptomic and metabolomic profile changes in the liver of Sprague Dawley rat offspring after maternal PFOS exposure during gestation and lactation,2024,1,NA,ECOTOXICOLOGY AND ENVIRONMENTAL SAFETY,0147-6513,270,NA,,"Zhang, Ruiyuan and Yu, Guoqi and Luo, Tingyu and Zeng, Xiaojing and Sun, Yan and Huang, Bo and Liu, Yongjie and Zhang, Jun",,,,,"Epidemiological and experimental research has indicated an association between perfluorooctane sulfonate (PFOS) exposure and liver disease. However, the potential hepatotoxic effects and mechanisms of low-level prenatal PFOS exposure in offspring remain ambiguous. The objective of this research was to examine the alterations in liver transcriptomic and metabolomic profiles in offspring rats at postnatal day (PND) 30 following gestational and lactational exposure to PFOS (from gestational day 1 to 20 and PND 1 to 21). Pregnant Sprague-Dawley rats were separated into a control group (3\% starch gel solution, oral gavage) and a PFOS exposure group (0.03 mg/kg body weight per day, oral gavage). Histopathological changes in liver sections were observed by hematoxylin and eosin staining. Biochemical analysis was conducted to evaluate changes in glucose and lipid metabolism. Transcriptomic and metabolomic analyses were utilized to identify significant genes and metabolites associated with alterations of liver glucose and lipid metabolism through an integrated multi-omics analysis. No significant differences were found in the measured biochemical parameters. In total, 167 significant differ-entially expressed genes (DEGs) related to processes such as steroid biosynthesis, PPAR signaling pathway, and fat digestion and absorption were identified in offspring rats in the PFOS exposure group. Ninety-five altered metabolites were exhibited in the PFOS exposure group, such as heptaethylene glycol, lysoPE (0:0/18:0), lucidenic acid K, and p-Cresol sulfate. DEGs associated with steroid biosynthesis, PPAR signaling pathway, fat digestion and absorption were significantly upregulated in the PFOS exposure group (P < 0.05). The analysis of correlations indicated that there was a significant inverse correlation between all identified differential metabolites and the levels of fasting blood glucose, high-density lipoprotein, and triglycerides in the PFOS exposure group (P < 0.05). Our findings demystify that early-life PFOS exposure can lead to alterations in transcriptomic and metabolomic profiles in the offspring's liver, which provided mechanistic insights into the potential hepatotoxicity and developmental toxicity associated with environmentally relevant levels of PFOS exposure.",,10.1016/j.ecoenv.2023.115862,"Transcriptome;Rats;Liver;Rats, Sprague-Dawley;Lactic Acid;Pregnancy;Lactates;Lactation",NA,,transcriptomic and metabolomic profile changes in the liver of sprague dawley rat offspring after maternal pfos exposure during gestation and lactation
