key,title,year,month,day,journal,issn,volume,issue,pages,authors,url,language,publisher,location,abstract,notes,doi,keywords,pubmed_id,pmc_id,title2
rayyan-1259294931,"Associations of per- and polyfluoroalkyl substances, polychlorinated biphenyls, organochlorine pesticides, and polybrominated diphenyl ethers with oxidative stress markers: A systematic review and meta-analysis",2023,12,NA,ENVIRONMENTAL RESEARCH,0013-9351,239,1,,"Chen, Jiawen Carmen and Baumert, Brittney O. and Li, Yijie and Li, Yiping and Pan, Shudi and Robinson, Shante and Rubbo, Bruna and Costello, Elizabeth and He, Jie and Hampson, Hailey and Beglarian, Emily and Rock, Sarah and Goodrich, Jesse A. and Eckel, S and rah P. and Aung, Max T. and Mcconnell, Rob and Conti, David V. and Chatzi, Lida",,,,,"Background: Per-and polyfluoroalkyl substances (PFAS), polychlorinated biphenyls (PCBs), organochlorine pesticides (OCPs), and polybrominated diphenyl ethers (PBDEs) are intentionally produced persistent organic pollutants (POPs) that are resistant to environmental degradation. Previous in-vitro and in-vivo studies have shown that POPs can induce oxidative stress, which is linked to neurodegenerative diseases, cardiovascular diseases, and cancer. However, findings in epidemiological studies are inconsistent and an evidence synthesis study is lacking to summarize the existing literature and explore research gaps.Objective: We evaluated the effects of PFAS, PCBs, OCPs, and PBDEs, on oxidative stress biomarkers in epide-miological studies.Methods: A literature search was conducted in PubMed, Embase, and Cochrane CENTRAL to identify all published studies related to POPs and oxidative stress up to December 7th, 2022. We included human observational studies reporting at least one exposure to POPs and an oxidative stress biomarker of interest. Random-effects meta-analyses on standardized regression coefficients and effect direction plots with one-tailed sign tests were used for quantitative synthesis.Results: We identified 33 studies on OCPs, 35 on PCBs, 49 on PFAS, and 12 on PBDEs. Meta-analyses revealed significant positive associations of alpha-HCH with protein carbonyls (0.035 {[}0.017, 0.054]) and of 4{''}4-DDE with malondialdehyde (0.121 {[}0.056, 0.187]), as well as a significant negative association between 2{''}4-DDE and total antioxidant capacity (TAC) (-0.042 {[}-0.079,-0.004]), all beta {[}95\%CI]. Sign tests showed a significant positive association between PCBs and malondialdehyde (pone-tailed = 0.03). Additionally, we found significant negative associations of OCPs with acetylcholine esterase (pone-tailed = 0.02) and paraoxonase-1 (pone-tailed = 0.03). How-ever, there were inconsistent associations of OCPs with superoxide dismutase, glutathione peroxidase, and catalase.Conclusions: Higher levels of OCPs were associated with increased levels of oxidative stress through increased pro-oxidant biomarkers involving protein oxidation, DNA damage, and lipid peroxidation, as well as decreased TAC. These findings have the potential to reveal the underlying mechanisms of POPs toxicity.",,10.1016/j.envres.2023.117308,Pesticides;Oxidative Stress;Ethers,NA,,associations of per and polyfluoroalkyl substances polychlorinated biphenyls organochlorine pesticides and polybrominated diphenyl ethers with oxidative stress markers a systematic review and metaanalysis
rayyan-1259294932,Mechanisms and pathways of PFAS degradation by advanced oxidation and reduction processes: A critical review,2022,12,NA,CHEMICAL ENGINEERING JOURNAL,1385-8947,450,4,,"Alalm, Mohamed Gar and Boffito, Daria Camilla",,,,,"Numerous studies have demonstrated the degradation of perfluoroalkyl substances (PFAS) by advanced oxidation or reduction processes. Howbeit, the current literature lacks a comprehensive and comparative overview of the various degradation pathways and mechanisms. This systematic review compiles and analyzes the mechanisms and degradation pathways of PFAS by persulfate activation, photocatalysis, UV/sulfite, electron beam, electrochemical oxidation, plasma, ozonation, and sonochemical oxidation. We found that the degradation pathways of perfluorocarboxylic acids (PFCAs) and Perfluoroalkanesulfonic acids (PFSAs) were investigated more than any other PFAS. This review implies that the defluorination and degradation pathways of PFAS are reliant on the type of dominant reactive oxidant or reductive species. For instance, holes usually oxidize PFAS to unstable perfluoroalkyl radicals accompanied by losing head groups, whereas hydroxyl and superoxide radicals cleave C-C and C-F bonds. On the other hand, hydrated electrons directly eliminate the head group followed by releasing CF2 units. Furthermore, the imposed crystal facets and functional groups of the introduced catalytic surfaces in the case of heterogeneous catalysis (e.g., photocatalysts) affected the degradation pathways and defluorination rates by anchoring PFAS molecules from the head groups (e.g., carboxylate and sulfonate group). This study lays the groundwork for future research to analyze and elucidate the transformation products and pathways of PFAS in various treatment systems.",,10.1016/j.cej.2022.138352,Oxidation-Reduction,NA,,mechanisms and pathways of pfas degradation by advanced oxidation and reduction processes a critical review
rayyan-1259294933,"Gestational GenX and PFOA exposures induce hepatotoxicity, metabolic pathway, and microbiome shifts in weanling mice",2024,1,NA,SCIENCE OF THE TOTAL ENVIRONMENT,0048-9697,907,NA,,"Zhang, Qin-Yao and Xu, Ling-Ling and Zhong, Mei-Ting and Chen, Yu-Kui and Lai, Ming-Quan and Wang, Qi and Xie, Xiao-Li",,,,,"Ammonium perfluoro (2-methyl-3-oxahexanoate) (GenX), a replacement for perfluorooctanoic acid (PFOA), has been detected in multiple environmental media and biological samples worldwide. Accumulated evidence implies that GenX exposure might exert adverse health effects, although the underlying mechanisms have not been fully revealed. In this study, pregnant BALB/c mice were exposed to GenX (2 mg/kg/day), PFOA (1 mg/kg/day), or Milli-Q water by gavage from the first day of gestation (GD0) until GD21. Necropsy and tissue collection were conducted in pups at 4 weeks of age. PFOA and GenX induced similar histopathological changes in both the liver and the intestinal mucosa, accompanied by higher serum levels of alanine and aspartate aminotransferase. Moreover, the capacity of hepatic glycogen storage and intestinal mucus secretion were significantly decreased, suggesting dysfunction of liver metabolism and the intestinal mucosal barrier. A total of 637 and 352 differentially expressed genes (DEGs) were identified in the liver tissues of GenX and PFOA group, respectively. Most of the enriched pathways from the DEGs by KEGG enrichment analysis were metabolism-associated. Moreover, overexpression of CYP4A14, Sult2a1, Cpt1b, Acaa1b, Igfbp1, Irs-2 and decreased expression of Gys2 wereobserved in livers of GenX exposed pups, supporting the hypothesis that there was metabolic disruption. Furthermore, DNA damage and cell cycle arrest proteins (Gadd45 beta, p21, Ppard) were significantly increased, while cell proliferation-related proteins (Cyclin E, Myc, EGFR) were decreased by gestational GenX exposure in the pups' liver. In addition, imbalance of gut microbiota and dysfunction of the intestinal mucosa barrier might contribute to hepatotoxicity at least in part. Taken together, our results suggested that gestational GenX exposure triggered metabolic disorder, which might be responsible for the hepatotoxicity in the pups in addition to dysfunction of the intestinal mucosa barrier. This study enriches the mechanisms of GenX-induced developmental hepatotoxicity by associating metabolic disorder with intestinal homeostasis.",,10.1016/j.scitotenv.2023.168059,Mice;Pregnancy,NA,,gestational genx and pfoa exposures induce hepatotoxicity metabolic pathway and microbiome shifts in weanling mice
rayyan-1259294934,Global patterns and temporal trends of perfluoroalkyl substances in municipal wastewater: A meta-analysis,2022,8,NA,WATER RESEARCH,0043-1354,221,NA,,"Cookson, Esther S. and Detwiler, Russell L.",,,,,"Despite increasing regulatory efforts to reduce production of per- and polyfluoroalkyl substances (PFAS), continued human and ecological exposure to PFAS has led to concerns about historical releases. Municipal wastewater treatment plants (WWTPs) provide important conduits between waste sources and the environment. We present a meta-analysis of results reported in 44 peer-reviewed publications that include 460 influent and 528 effluent samples, collected from 21 countries, for which some or all of five per-fluorinated carboxylic acids (PFCAs) and three perfluorinated sulfonic acids (PFSAs) were measured. Our meta analysis revealed global patterns and trends that, to our knowledge, have not been reported elsewhere. Regression analyses of samples collected from 2004 to 2020 quantified the temporal trends of global wastewater effluent concentrations of each of the PFAS and the corresponding mean concentration for each country. Although legacy compounds, perfluoroctanoic acid (PFOA) and perfluorooctanesulfonic acid (PFOS), have been reported with the highest measured concentrations, their global temporal trends are lowest of all PFAS considered. Concentrations of most PFAS analyzed in wastewater in the United States have not changed significantly with time, whereas reported PFAS concentrations in wastewater effluent from China have increased from 11\% to 37\% per year. In addition, our results show significant positive correlations between previous wastewater effluent concentrations of individual PFAS and the gross domestic product per capita of each country. Our analysis of this global data set also confirmed conclusions from previous studies on smaller data sets: (i) none of the PFAS studied are effectively removed by conventional treatment processes; (ii) effluents from treatment plants that include a significant industrial component to their influent tend to have higher PFAS concentrations; and (iii) the few studies that measured both aqueous concentrations and concentrations adsorbed to suspended particulate matter (SPM) indicate that PFAS adsorbed to SPM can contribute significantly to the total PFAS load.",,10.1016/j.watres.2022.118784,,NA,,global patterns and temporal trends of perfluoroalkyl substances in municipal wastewater a metaanalysis
rayyan-1259294935,Exposure to perfluoroalkyl substances and risk of hepatocellular carcinoma in a multiethnic cohort,2022,10,NA,JHEP REPORTS,,4,10,,"Goodrich, Jesse A. and Walker, Douglas and Lin, Xiangping and Wang, Hongxu and Lim, Tiffany and McConnell, Rob and Conti, David V. and Chatzi, Lida and Setiawan, Veronica Wendy",,,,,"Background \& Aims: Exposure to poly-and perfluoroalkyl substances (PFAS), a class of persistent organic pollutants, is ubiquitous. Animal studies suggest that PFAS may increase risk of fatty liver and hepatocellular carcinoma (HCC) via impacts on hepatic lipid, amino acid, and glucose metabolism, but human data is lacking. We examined associations between PFAS exposure, altered metabolic pathways, and risk of non-viral HCC. Methods: In this nested case-control study, pre-diagnostic plasma PFAS and metabolomics were measured in 50 incident HCC cases and 50 individually matched controls from the Multiethnic Cohort (MEC) study. Cases/controls were matched by age, sex, race, and study area. PFAS exposure and risk of HCC were examined using conditional logistic regression. A metabolome-wide association study and pathway enrichment analysis was performed for PFAS exposure and HCC risk, and key metabolites/metabolic pathways were identified using a meet in the middle approach. Results: High perfluorooctane sulfonic acid (PFOS) levels (90th percentile from NHANES; > 55 lg/L) were associated with 4.5 -fold increased risk of HCC (odds ratio 4.5, 95\% CI 1.2-16.0). Pathway enrichment analysis showed that PFOS exposure was associated with alterations in amino acid and glycan biosynthesis pathways, which were also associated with HCC risk. We identified 4 metabolites linking PFOS exposure with HCC, including glucose, butyric acid (a short-chain fatty acid), alpha-ketoisovaleric acid (a branched-chain a-keto acid), and 7 alpha-hydroxy-3-oxo-4-cholestenoate (a bile acid), each of which was positively associated with PFOS exposure and risk of HCC. Conclusion: This proof-of-concept analysis shows that exposure to high PFOS levels was associated with increased risk of non-viral HCC, likely via alterations in glucose, amino acid, and bile acid metabolism. Larger studies are needed to confirm these findings. Lay summary: Per-and polyfluoroalkyl substances (PFAS), often referred to as ``forever chemicals `` because they are difficult to break down and stay in the human body for years, are extremely common and can cause liver damage. In a first of its kind study, we found that exposure to high levels of perfluorooctanesulfonic acid, one of the most common PFAS chemicals, was linked to increased risk of hepatocellular carcinoma in humans. Hepatocellular carcinoma is difficult to treat and is one of the most common forms of liver cancer, and these findings may provide new avenues for helping to prevent this disease.(c) 2022 The Author(s). Published by Elsevier B.V. on behalf of European Association for the Study of the Liver (EASL).",,10.1016/j.jhepr.2022.100550,"Carcinoma, Hepatocellular",NA,,exposure to perfluoroalkyl substances and risk of hepatocellular carcinoma in a multiethnic cohort
rayyan-1259294936,Endocrine-disrupting chemicals and breast cancer: a meta-analysis,2023,11,NA,FRONTIERS IN ONCOLOGY,2234-943X,13,NA,,"Liu, Haiyan and Sun, Yukun and Ran, Longkai and Li, Jiuling and Shi, Yafei and Mu, Chunguang and Hao, Changfu",,,,,"Background: Globally, the burden of breast cancer has increased significantly in recent decades. Emerging evidence suggested that endocrine-disrupting chemicals (EDCs), which have the potential to interfere with the function of normal hormones, may play a crucial role in this trend. However, the potential relationships were inconsistent in various studies. Objective and search methods: In our study, we sought to fully evaluate the currently available epidemiological evidence to ascertain whether certain EDC congeners and their metabolites are related to breast cancer risk. Following the Preferred Reporting Items for Systematic Reviews and Meta-Analyses guidelines, we conducted a comprehensive literature search of original peer-reviewed publications in three electronic databases: PubMed, Web of Science, and Embase. Publications that covered xenobiotic EDC exposures and breast cancer-confirmed histological results or antecedent medical records or reporting to health registers were taken into consideration. Outcomes: The final result of the literature search was 6,498 references, out which we found 67 publications that matched the requirements for meta-analysis and eight publications for qualitative trend synthesis. In this meta-analysis, statistically significant associations revealed that (i) 1-chloro-4-{[}2,2,2-trichloro-1-(4-chlorophenyl)ethyl]benzene (p,p'-DDT) and its major metabolite 2,2-bis(4-chlorophenyl)-1,1-dichloroethylene (p,p'-DDE) were somewhat related to a greater risk of breast cancer. However, this relationship only existed in blood serum but not in adipose tissue. (ii) Breast cancer risk was increased by exposure to chlordane and hexachlorocyclohexane. (iii) Five polychlorinated biphenyls (PCB 99, PCB 105, PCB 118, PCB 138, and PCB 183) can increase the risk of breast cancer. (iv) One phthalate congener (BBP) and one per- and polyfluoroalkyl substance congener (PFDoDA) were negatively associated with breast cancer risk. Unfortunately, heterogeneity was not well explained in our review, and a limited number of available prospective studies investigating the associations between EDC exposure and breast cancer were included in our meta-analysis. To elucidate the overall associations, future large, longitudinal epidemiological investigations are needed.",,10.3389/fonc.2023.1282651,Breast Neoplasms,NA,,endocrinedisrupting chemicals and breast cancer a metaanalysis
rayyan-1259294937,A metabolomic investigation of serum perfluorooctane sulfonate and perfluorooctanoate,2023,10,NA,ENVIRONMENT INTERNATIONAL,0160-4120,180,NA,,"Rhee, Jongeun and Loftfield, Erikka and Albanes, Demetrius and Layne, Tracy M. and Stolzenberg-Solomon, Rachael and Liao, Linda M. and Playdon, Mary C. and Berndt, Sonja I. and Sampson, Joshua N. and Freedman, Neal D. and Moore, Steven C. and Purdue, Mark P.",,,,,"Background: Exposures to perfluorooctane sulfonate (PFOS) and perfluorooctanoate (PFOA), environmentally persistent chemicals detectable in the blood of most Americans, have been associated with several health out-comes. To offer insight into their possible biologic effects, we evaluated the metabolomic correlates of circulating PFOS and PFOA among 3,647 participants in eight nested case-control serum metabolomic profiling studies from the Prostate, Lung, Colorectal, and Ovarian Cancer Screening Trial.Methods: Metabolomic profiling was conducted by Metabolon Inc., using ultra high-performance liquid chro-matography/tandem accurate mass spectrometry. We conducted study-specific multivariable linear regression analyses estimating the associations of metabolite levels with levels of PFOS or PFOA. For metabolites measured in at least 3 of 8 nested case-control studies, random effects meta-analysis was used to summarize study-specific results (1,038 metabolites in PFOS analyses and 1,100 in PFOA analyses). Results: The meta-analysis identified 51 and 38 metabolites associated with PFOS and PFOA, respectively, at a Bonferroni-corrected significance level (4.8x10-5 and 4.6x10-5, respectively). For both PFOS and PFOA, the most common types of associated metabolites were lipids (sphingolipids, fatty acid metabolites) and xenobiotics (xanthine metabolites, chemicals). Positive associations were commonly observed with lipid metabolites sphingomyelin (d18:1/18:0) (P = 2.0x10-10 and 2.0x10-8, respectively), 3-carboxy-4-methyl-5-pentyl-2-furanpro-pionate (P = 2.7x10-15, 1.1x10-17), and lignoceroylcarnitine (C24) (P = 2.6x10-8, 6.2x10-6). The strongest pos-itive associations were observed for chemicals 3,5-dichloro-2,6-dihydroxybenzoic acid (P = 3.0x10-112 and 6.8x10-13, respectively) and 3-bromo-5-chloro-2,6-dihydroxybenzoic acid (P = 1.6x10-14, 2.3x10-6). Other me-tabolites positively associated with PFOS included D-glucose (carbohydrate), carotene diol (vitamin A meta-bolism), and L-alpha-aminobutyric acid (glutathione metabolism), while uric acid (purine metabolite) was positively associated with PFOA. PFOS associations were consistent even after adjusting for PFOA as a covariate, while PFOA associations were greatly attenuated with PFOS adjustment.Conclusions: In this large metabolomic study, we observed robust positive associations with PFOS for several molecules. Further investigation of these metabolites may offer insight into PFOS-related biologic effects.",,10.1016/j.envint.2023.108198,Sulfones,NA,,a metabolomic investigation of serum perfluorooctane sulfonate and perfluorooctanoate
rayyan-1259294938,Occurrence and environmental risk assessment of 22 pesticides in Brazilian freshwaters,2023,7,NA,AQUATIC TOXICOLOGY,0166-445X,260,NA,,"Brovini, Emilia Marques and Quadra, Gabrielle Rabelo and Paranaiba, Jose R. and Carvalho, Luana and Pereira, Renata de Oliveira and de Aquino, Sergio Fracisco",,,,,"Pesticide contamination in water resources is a global threat. Although usually found at low concentrations, pesticides raise considerable toxicological concerns, mainly when mixtures are considered. The occurrence of 22 pesticides (2,4 D, alachlor, aldicarb, aldrin, atrazine, carbendazim, carbofuran, chlordane, chlorpyrifos, DDT, diuron, glyphosate, lindane, mancozeb, methamidophos, metolachlor, molinate, profenofos, simazine, tebuconazole, terbufos, and trifluralin) was investigated, through consolidated database information, in surface freshwaters of Brazil. Moreover, scenarios of environmental risk assessment considering isolated compounds and mixtures were performed, as well as a meta-analytic approach for toxicity purposes. Pesticides in freshwater have been reported from 719 cities (12.9\% of Brazilian cities), where 179 (3.2\%) showed pesticide occurrence above the limit of detection or quantification. Considering cities with more than five quantified, 16 cities were prone to environmental risks considering individual risks. However, the number increased to 117 cities when the pesticide mixture was considered. The mixture risk was driven by atrazine, chlorpyrifos, and DDT. The national maximum acceptable concentrations (MAC) for nearly all pesticides are higher than the predicted no-effect concentration (PNEC) for the species evaluated, except aldrin. Our results show the need to consider mixtures in the environmental risk assessment to avoid underestimation and review MAC to protect aquatic ecosystems. The results presented here may guide the revision of the national environmental legislation to ensure the protection of Brazilian aquatic ecosystems.",,10.1016/j.aquatox.2023.106566,Risk Assessment;Pesticides,NA,,occurrence and environmental risk assessment of 22 pesticides in brazilian freshwaters
rayyan-1259294939,The role of perfluorooctane sulfonic acid (PFOS) exposure in inflammation of intestinal tissues and intestinal carcinogenesis,2023,8,NA,FRONTIERS IN TOXICOLOGY,,5,NA,,"Durham, Jerika and Tessmann, Josiane Weber and Deng, Pan and Hennig, Bernhard and Zaytseva, Yekaterina Y.",,,,,"PFAS (per- and polyfluoroalkyl substances) are organofluorine substances that are used commercially in products like non-stick cookware, food packaging, personal care products, fire-fighting foam, etc. These chemicals have several different subtypes made of varying numbers of carbon and fluorine atoms. PFAS substances that have longer carbon chains, such as PFOS (perfluorooctane sulfonic acid), can potentially pose a significant public health risk due to their ability to bioaccumulate and persist for long periods of time in the body and the environment. The National Academies Report suggests there is some evidence of PFOS exposure and gastrointestinal (GI) inflammation contributing to ulcerative colitis. Inflammatory bowel diseases such as ulcerative colitis are precursors to colorectal cancer. However, evidence about the association between PFOS and colorectal cancer is limited and has shown contradictory findings. This review provides an overview of population and preclinical studies on PFOS exposure and GI inflammation, metabolism, immune responses, and carcinogenesis. It also highlights some mitigation approaches to reduce the harmful effects of PFOS on GI tract and discusses the dietary strategies, such as an increase in soluble fiber intake, to reduce PFOS-induced alterations in cellular lipid metabolism. More importantly, this review demonstrates the urgent need to better understand the relationship between PFOS and GI pathology and carcinogenesis, which will enable development of better approaches for interventions in populations exposed to high levels of PFAS, and in particular to PFOS.",,10.3389/ftox.2023.1244457,Sulfones;Inflammation;Sulfonic Acids,NA,,the role of perfluorooctane sulfonic acid pfos exposure in inflammation of intestinal tissues and intestinal carcinogenesis
rayyan-1259294940,Per- and polyfluoroalkyl substances (PFASs) in consumable species and food products,2023,9,NA,JOURNAL OF FOOD SCIENCE AND TECHNOLOGY-MYSORE,0022-1155,60,9,2319-2336,"Torres, Fern and o G. and De-la-Torre, Gabriel E.",,,,,"Per- and polyfluoroalkyl substances (PFASs) are a group of thousands of manmade chemicals widely used in consumer products and industrial processes. Toxicological studies have suggested that exposure to PFASs may lead to several adverse effects, including infertility and cancer development. In light of their widespread use, the contamination of food products has created health concerns in sites directly influenced by industrial and anthropogenic activity. In the present contribution, the current knowledge of PFAS contamination was systematically reviewed in order to provide with the knowledge gaps and main sources of contamination, as well as critically evaluate estimated dietary intake and relative risk values of the consulted studies. Legacy PFASs remain the most abundant despite their production restrictions. Edible species from freshwater bodies exhibit higher PFAS concentrations than marine species, probably due to low hydrodynamics and dilution in lentic ecosystems. Studies in food products from multiple sources, including aquatic, livestock, and agricultural, agree that the proximity to factories and fluorochemical industries rendered significantly higher and potentially hazardous PFAS contamination. Short-chain PFAS are suggested as chemicals of emerging concern to food security. However, the environmental and toxicological implications of short-chain congeners are not fully understood and, thus, much research is needed in this sense.",,10.1007/s13197-022-05545-7,,NA,,per and polyfluoroalkyl substances pfass in consumable species and food products
