key,title,year,month,day,journal,issn,volume,issue,pages,authors,url,language,publisher,location,abstract,notes,doi,keywords,pubmed_id,pmc_id,title2
rayyan-1259295083,"Solar light driven transition metal codoped ZnO (Ag, Ni- codoped ZnO) for environmental remediation",2023,5,NA,INDIAN JOURNAL OF CHEMICAL TECHNOLOGY,0971-457X,30,3,352-360,"Sonia, D. and Vasam, E. K. Kirupa",,,,,"Visible light efficient Ag, Ni-codoped ZnO photocatalyst has been synthesised in the nano form by co-precipitation and sonochemical method using ZnSO4 ꞏ7H2O as a precursor. The structural, morphological and elemental observations of synthesised photocatalyst have been characterized using X-ray diffraction (XRD), FTIR, UV-DRS, SEM with EDX and HRTEM analysis. Incorporation of metal ions into ZnO lattice caused a red shift in the absorption band thus extending its absorption towards visible region through inhibition of electron hole recombination reaction and through the property of surface plasmon resonance (SPR). However the addition of silver and nickel ions has modified the electronic and optical properties of the photocatalyst thus improving the photocatalytic performance of the sample. The photocatalytic performance of Ag, Ni-codoped ZnO nanoparticles have been tested for degradation of Direct Red 81 dye (DR-81), as pollutant in aqueous solution. Under the optimum conditions (20 ppm dye and 10 mg/L photocatalyst), complete mineralization of dye solution under study was achieved within 40min of time duration. The Ag, Ni-codoped ZnO photocatalyst is thermally stable and efficient for five successive consecutive runs thus retaining its efficiency towards degradation. The overall results thus obtained have suggested that a suitable method for the detoxification of environmental pollutants emerging from industries.",,10.56042/ijct.v30i3.70650,,NA,,solar light driven transition metal codoped zno ag ni codoped zno for environmental remediation
rayyan-1259295084,Review on green biomass-synthesized metallic nanoparticles and composites and their photocatalytic water purification applications: Progress and perspectives,2023,5,NA,CHEMICAL ENGINEERING JOURNAL ADVANCES,2666-8211,14,NA,,"Shahid-ul-Islam and Bairagi, Satyaranjan and Kamali, Mohammad Reza",,,,,"In recent years, the use of biomass for the cost-effective synthesis of nanoparticles has emerged as a promising green technology. Because of their remarkable properties, such as tunable surface plasmon resonance characteristics and high surface areas, bio-synthesised nanomaterials are receiving more scientific and academic attention for their use in various application sectors, especially as catalysts in environmental remediation. Green synthesized nanomaterial's can efficiently contribute to the degradation of a wide range of organic pollutants, including dyes, into harmless by-products. These particles have a cure for recalcitrant organic and inorganic pollutants due to their photocatalytic properties, which largely depend on the production of reactive oxygen species under sunlight or UV illumination. This comprehensive review systematically covers up-to-date knowledge on recent developments in the green synthesis of nanoparticles and composites using plants and microorganisms, unravels underlying mechanisms, and highlights their application areas. It then provides detailed information on their applications in the degradation of potentially toxic organic dyes and the removal of other emerging pollutants, including heavy metals and antibiotics. Finally, the current challenges and perspectives of this technology for future applications are discussed.",,10.1016/j.ceja.2023.100460,,NA,,review on green biomasssynthesized metallic nanoparticles and composites and their photocatalytic water purification applications progress and perspectives
rayyan-1259295085,"Human Health Risk Assessment of Heavy Metal Concentration in Seafood Collected from Pattani Bay, Thailand",2023,1,NA,TOXICS,,11,1,,"Tanhan, Phanwimol and Lansubsakul, Niyada and Phaochoosak, Napasorn and Sirinupong, Pattanasuda and Yeesin, Pun and Imsilp, Kanjana",,,,,"A significant impact of marine pollution is the contamination of seafood which has raised concerns due to its potential human health risks. This current study investigated seasonal bioaccumulation of 9 heavy metals (Cd, Co, Cr, Cu, Fe, Mn, Ni, Pb, and Zn) in 14 commercially important seafood species, including 4 fish, 5 molluscs, and 5 crustacean species. Samples were collected from Pattani Bay, Pattani province, Thailand, during the dry (July 2020) and wet (February 2021) seasons. The edible samples were analyzed for heavy metal concentrations using a flame atomic absorption spectrophotometer. The bioaccumulation trend of heavy metals decreased in the sequence of molluscs > crustaceans > fish. The possible human health risks associated with heavy metal-contaminated seafood consumption were assessed. The parameters investigated for non-carcinogenic and carcinogenic were target hazard quotient (THQ), total hazard index (HI), and target cancer risk (TR). The average ranges of THQs (7.79 x 10(-8)-8.97 x 10(-3)), HIs (4.30 x 10(-5)-1.55 x 10(-2)), and TRs (2.70 x 10(-9)-1.34 x 10(-5)) were observed in the studied seafood species. The results revealed no non-carcinogenic and carcinogenic health risks from consuming these 14 kinds of seafood.",,10.3390/toxics11010018,"Humanities;Humanism;Humans;Risk Assessment;Metals, Heavy;Thailand",NA,,human health risk assessment of heavy metal concentration in seafood collected from pattani bay thailand
rayyan-1259295086,Revealing the metabolomics and biometrics underlying phytotoxicity mechanisms for polystyrene nanoplastics and dibutyl phthalate in dandelion (Taraxacum officinale),2023,12,NA,SCIENCE OF THE TOTAL ENVIRONMENT,0048-9697,905,NA,,"Li, Xingfan and Zhang, Ye and Wang, Jianxin and Zeng, Guangnian and Tong, Xin and Ullah, Shakir and Liu, Jia and Zhou, Ranran and Lian, Jiapan and Guo, Xiaorui and Tang, Zhonghua",,,,,"Micro/nanoplastics (M/NPs) and phthalates (PAEs) are emerging pollutants. Polystyrene (PS) MPs and dibutyl phthalate (DBP) are typical MPs and PAEs in the environment. However, how dandelion plants respond to the combined contamination of MPs and PAEs remains unclear. In this study, we evaluated the individual and combined effects of PS NPs (10 mg L-1) and DBP (50 mg L-1) on dandelion (Taraxacum officinale) seedlings. The results showed that compared to control and individual-treated plants, coexposure to PS NPs and DBP signifi-cantly affected plant growth, induced oxidative stress, and altered enzymatic and nonenzymatic antioxidant levels of dandelion. Similarly, photosynthetic attributes and chlorophyll fluorescence kinetic parameters were significantly affected by coexposure. Scanning electron microscopy (SEM) results showed that PS particles had accumulated in the root cortex of the dandelion. Metabolic analysis of dandelion showed that single and combined exposures caused the plant's metabolic pathways to be profoundly reprogrammed. As a consequence, the synthesis and energy metabolism of carbohydrates, amino acids, and organic acids were affected because galactose metabolism, the citric acid cycle, and alanine, aspartic acid and glutamic acid metabolism pathways were significantly altered. These results provide a new perspective on the phytotoxicity and environmental risk assessment of MPs and PAEs in individual or coexposures.",,10.1016/j.scitotenv.2023.167071,,NA,,revealing the metabolomics and biometrics underlying phytotoxicity mechanisms for polystyrene nanoplastics and dibutyl phthalate in dandelion taraxacum officinale
rayyan-1259295087,Catalytic elimination of chlorinated organic pollutants by emerging single-atom catalysts,2022,12,NA,CHEMICAL ENGINEERING JOURNAL,1385-8947,450,4,,"Yang, Kaixiong and Kong, Yi-Jie and Huang, Li-Zhi and Hu, Xin-Ming",,,,,"Chlorinated organic pollutants (COPs) are bioaccumulative, hazardous, and potentially carcinogenic, threatening human health and ecosystems. Catalytic degradation using single-atom catalysts (SACs) is emerging as a promising technology for COPs removal, accomplishing high efficiency in both aqueous and gaseous environ-ments. This review systematically summarizes the recent development in catalytic degradation of COPs using a variety of SACs, focusing on the understanding of structure-performance relationships and key mechanisms involved. First, the SACs-promoted COPs dechlorination through the reduction process is evaluated. Second, the oxidation process for COPs degradation is presented, followed by the discussion of the synergic reduc-tion-oxidation degradation process. Last, the existing challenges in this field and possible solutions are proposed, hoping to offer inspiration and guidance for the future applications of SACs in COPs elimination.",,10.1016/j.cej.2022.138467,Nebulizers and Vaporizers,NA,,catalytic elimination of chlorinated organic pollutants by emerging singleatom catalysts
rayyan-1259295088,A Review of Advances in Fabrication Methods and Assistive Technologies of Micro-Structured Surfaces,2023,4,NA,PROCESSES,,11,5,,"Ma, Yuting and Zhang, Guoqing and Cao, Shuaikang and Huo, Zexuan and Han, Junhong and Ma, Shuai and Huang, Zejia",,,,,"Micro-structured surfaces possess excellent properties of friction, lubrication, drag reduction, antibacterial, and self-cleaning, which have been widely applied in optical, medical, national defense, aerospace fields, etc. Therefore, it is requisite to study the fabrication methods of micro-structures to improve the accuracy and enhance the performance of micro-structures. At present, there are plenty of studies focusing on the preparation of micro-structures; therefore, systematic review of the technologies and developing trend on the fabrication of micro-structures are needed. In present review, the fabrication methods of various micro-structures are compared and summarized. Specially, the characteristics and applications of ultra-precision machining (UPM) technology in the fabrication of micro-structures are mainly discussed. Additionally, the assistive technologies applied into UPM, such as fast tool servo (FTS) technology and slow tool servo (STS) technology to fabricate micro-structures with different characteristics are summarized. Finally, the principal characteristics and applications of fly cutting technology in manufacturing special micro-structures are presented. From the review, it is found that by combining different machining methods to prepare the base layer surface first and then fabricate the sublayer surface, the advantages of different machining technologies can be greatly exerted, which is of great significance for the preparation of multi-layer and multi-scale micro-structures. Furthermore, the combination of ultra-precision fly cutting and FTS/STS possess advantages in realizing complex micro-structures with high aspect ratio and high resolution. However, residual tool marks and material recovery are still the key factors affecting the form accuracy of machined micro-structures. This review provides advances in fabrication methods and assistive technologies of micro-structured surfaces, which serves as the guidance for both fabrication and application of multi-layer and multi-scale micro-structures.",,10.3390/pr11051337,Self-Help Devices,NA,,a review of advances in fabrication methods and assistive technologies of microstructured surfaces
rayyan-1259295089,Microplastic Pollution and Monitoring in Seawater and Harbor Environments: A Meta-Analysis and Review,2023,6,NA,SUSTAINABILITY,,15,11,,"Belioka, Maria-Paraskevi and Achilias, Dimitrios S.",,,,,"Due to its widespread occurrence in practically all environmental sectors, including the terrestrial, marine, and atmospheric, microplastics (MP) have transitioned from an emerging pollutant to a chronic contaminant. Studies on the prevalence and hazardous effects on marine creatures have been conducted all over the world, but only in coastal environments. Microplastic pollution has emerged as a global concern in marine environments and a danger to animals, predators, and humans because it has been discovered in the marine environment all over the world. This review examines the quantity of MP samples around the world and their colonization by marine microorganisms, as well as the detection, features, origins, and ecological implications of paint fragments and resins in our oceans and ports. These polymers are derived from paints and the fiber reinforced plastic (FRP) matrix used in shipbuilding. Microplastics should be regarded as coming from synthetic polymers found in ship coatings. For assessing microplastic pollution, choosing an appropriate sample technique is essential. Additionally, this review offers an overview of MP investigation methods, concentrating on sampling techniques, laboratory procedures, and the identification of MPs found in seawater, as well as assessing how well they apply to the seaport environment. Because of the widespread discovery of MP pollution, particularly in Africa, Asia, India, South Africa, North America, and Europe, it is clear that monitoring is crucial for determining the efficacy of mitigation efforts to limit the quantity of waste plastic entering the environment, especially through sensors and real-time information transfer systems (e.g., smart digital seawater monitoring).",,10.3390/su15119079,,NA,,microplastic pollution and monitoring in seawater and harbor environments a metaanalysis and review
rayyan-1259295090,Microplastics sequestered in the soil affect the turnover and stability of soil aggregates: A review,2023,12,NA,SCIENCE OF THE TOTAL ENVIRONMENT,0048-9697,904,NA,,"Ju, Tianhang and Yang, Kai and Chang, Lei and Zhang, Keyi and Wang, Xingyi and Zhang, Jialin and Xu, Bo and Li, Yuefen",,,,,"Plastic products have become ubiquitous in society, and entered various ecosystems due to the massive scale of production. The United Nations Environment Program (UNEP) has listed microplastics (MPs), which form when plastic remnants degrade, as a global emerging pollutant, and the association between soil pollution and MPs has become a popular research topic. This paper systematically reviews research focusing on MP-related soil pollution from the past 10 years (2012-2022), with the identified papers demonstrating that interactions be-tween MPs and soil aggregates has become a research frontier in the field. The presented research provides evidence that soil aggregates are important storage sites for MPs, and that storage patterns of MPs within soil aggregates are influenced by MP characteristics. In addition, MPs affect the formation, turnover, and stability of soil aggregates through the introduction of fracture points along with diverse physicochemical characteristics such as composition and specific surface area. The current knowledge base includes certain issues and challenges that could be addressed in future research by extending the spatial and temporal scales over which microplastic-soil aggregate interactions are studied, unifying quantitative and qualitative methods, and tracing the fates of MPs in the soil matrix. This review contributes to enriching our understanding of how terrestrial MPs interact with soil aggregates, and whether they pose a risk to soil health.",,10.1016/j.scitotenv.2023.166776,,NA,,microplastics sequestered in the soil affect the turnover and stability of soil aggregates a review
rayyan-1259295091,Removal of most frequent microplastic types and sizes in secondary effluent using Al<sub>2</sub>(SO<sub>4</sub>)<sub>3</sub>: choosing variables by a fuzzy Delphi method,2023,11,NA,SCIENTIFIC REPORTS,2045-2322,13,1,,"Azizi, Nahid and Pirsaheb, Meghdad and Haghighi, Nematollah Jaafarzadeh and Nodehi, Ramin Nabizadeh",,,,,"Microplastics (MPs) as an emerging pollutant can affect aquatic organisms through physical ingestion, chemical problems and possible creation of biological layers on their surfaces in the environment. One of the significant ways for MPs to enter the aquatic environment is through the effluent discharge of wastewater treatment plants (WWTPs). In this study, first, the concentration and characteristics of MPs in secondary wastewater effluent, and the influential variables related to the coagulation process, for MPs removal were identified using systematic reviews of previous studies. Then, the most proper MPs characterization and coagulation variables were chosen by experts' opinions using a fuzzy Delphi method. Therefore, the experiment tested in conditions close to the full-scale wastewater treatments. Finally, in the laboratory removal of MPs by coagulation of polyamide (PA), polystyrene (PS), and polyethylene (PE), < 125 and 300-600 mu m in size, was tested by a jar test applying Al-2(SO4)(3) in doses of 5 to 100 mg/L plus 15 mg/L polyacrylamide as a coagulant aid. Using R and Excel software, the results were analyzed statistically. It was concluded that the maximum and minimum removal efficiency was 74.7 and 1.39\% for small PA and large PE, respectively. Smaller MPs were found to have higher removal efficiency. The MPs type PA achieved greater removal efficiency than PS, while PE had the least removal efficiency.",,10.1038/s41598-023-47803-4,,NA,,removal of most frequent microplastic types and sizes in secondary effluent using al<sub>2<sub>so<sub>4<sub><sub>3<sub> choosing variables by a fuzzy delphi method
rayyan-1259295092,"Polystyrene microplastic attenuated the toxic effects of florfenicol on rice<i> (Oryza</i><i> sativa</i> L.) seedlings in hydroponics: From the perspective of oxidative response, phototoxicity and molecular metabolism",2023,10,NA,JOURNAL OF HAZARDOUS MATERIALS,0304-3894,459,NA,,"Shen, Luoqin and Zhang, Ping and Lin, Yanyao and Huang, Xinting and Zhang, Siyi and Li, Zhiheng and Fang, Zhiguo and Wen, Yuezhong and Liu, Huijun",,,,,"Antibiotics and microplastics (MPs) are two emerging pollutants in agroecosystems, however the effects of coexposure to antibiotics and MPs remain unclear. The toxicity of florfenicol (FF) and polystyrene microplastics (PS-MPs) on rice seedlings was investigated. FF and PS-MPs caused colloidal agglomeration, which changed the environmental behavior of FF. FF inhibited rice growth and altered antioxidant enzyme (superoxide dismutase, peroxidase, and catalase) activities, leading to membrane lipid peroxidation; impaired photosynthetic systems, decreased photosynthetic pigments (Chlorophyll a, Chlorophyll b, and carotene), chlorophyll precursors (Proto IX, Mg-Proto IX, and Pchlide), photosynthetic and respiratory rates. The key photosynthesis related genes (PsaA, PsaB, PsbA, PsbB, PsbC, and PsbD) were significantly down-regulated. The ultrastructure of mesophyll cells was destroyed with chloroplast swelling, membrane surface blurring, irregular thylakoid lamellar structure, and number of peroxisomes increased. PS-MPs mitigated FF toxicity, and the IBR index values showed that 10 mg \& BULL;L-1 PS-MPs were more effective. Metabolomic analysis revealed that the abundance of metabolites and metabolic pathways were altered by FF, was greater than the combined ``MPs-FF{''} contamination. The metabolism of amino acids, sugars, and organic acids were severely interfered. Among these, 15 metabolic pathways were significantly altered, with the most significant effects on phenylalanine metabolism and the citric acid cycle (p < 0.05).",,10.1016/j.jhazmat.2023.132176,Oryza sativa,NA,,polystyrene microplastic attenuated the toxic effects of florfenicol on rice<i> oryza<i><i> sativa<i> l seedlings in hydroponics from the perspective of oxidative response phototoxicity and molecular metabolism
rayyan-1259295093,Nontargeted metabolomic evidence for antagonism between tetracycline and its resistance bacteria underlying their obesogenic effects on Caenorhabditis elegans,2023,2,NA,SCIENCE OF THE TOTAL ENVIRONMENT,0048-9697,859,1,,"Li, Zhuo and Wu, Di and Yu, Zhenyang and Cui, Changzheng and Yin, Daqiang",,,,,"Environmental antibiotics raise serious health concerns due to their contribution to the obesity prevalence. Moreover, antibiotics promote antibiotic-resistance bacteria (ARB) which represent another emerging pollutant. However, the interaction between antibiotic and ARB in the obesogenic effects remained unexplored. In the present study, the obesogenic effects of tetracycline antibiotic (TCH) and ARB containing tetA were studied on C. elegans, and E. coli OP50 (OP50) was referred as a normal bacterial food. Results showed that TCH stimulated nematode triglyceride contents, while ARB alone had no significant influences. The combination of TCH and ARB showed less obesogenic effects than TCH alone, showing antagonism. Biochemical assays showed that the combination of TCH and ARB showed similar effects to ARB alone, and had less increases in lipid metabolism enzymes or metabolites than those of TCH or ARB alone, supporting the antagonism. In the nontargeted metabolomic analysis, TCH with ARB showed less significantly changed metabolites (SCMs) in the nematodes than TCH or ARB alone, partially explaining the antagonism. The metabolomic results also pointed out the significant involvement of amino acids, the carboxylic acids and derivatives, and also the benzene and substituted derivatives in the obesogenic effects of TCH and ARB. The findings of the present study provided a direct support for interaction between antibiotics and ARB underlying their health risks.",,10.1016/j.scitotenv.2022.160223,Tetracycline;Tetracyclines;Bacteria,NA,,nontargeted metabolomic evidence for antagonism between tetracycline and its resistance bacteria underlying their obesogenic effects on caenorhabditis elegans
rayyan-1259295094,"Photocatalysis of carbamazepine via activating bisulfite by ultraviolet: Performance, transformation mechanism, and residual toxicity assessment of intermediates products",2023,2,NA,CHEMOSPHERE,0045-6535,315,NA,,"Jin, Xu and Yao, Siyu and Liu, Yang and Tang, Jin and Zhu, Minghan and Liu, Hang and Yu, Yuanyuan and Yu, Xiaolong and Sun, Jianteng",,,,,"Carbamazepine (CBZ) as an extensively distributed emerging pollutant has menaced ecological security. The degradation performance of CBZ by UV driven bisulfite process was investigated in this work. The kinetics results indicated that CBZ was high-efficiently degraded by UV/bisulfite following a pseudo first-order kinetic model (K-obs = 0.0925 min(-1)). SO4 center dot- and center dot OH were verified as the reactive oxidants by EPR test and the radicals scavenging experiment using MeOH and TBA. SO4 center dot- played a dominant role for CBZ degradation. The Density functional theory (DFT) and LC-qTOF-MS/MS clarified that hydroxylation, ketonation, ring opening reaction, and ring contraction were main transformation patterns of CBZ. As to influence factors, CBZ degradation was significantly hindered in presence of CO32-, HPO42- and NOM. Toxicological analysis derived from metabonomics suggested that the remarkable alteration of metabolic profile was triggered by exposure to intermediates mixture. CBZ intermediates interfered in several key metabolic pathways, including pentose phosphate, amino acids, lysine degradation, glycerophospholipid, glutathione, nucleotides and carbohydrate, which was alleviated after UV/bisulfite treatment. This work provided a meaningful support to potential risk of CBZ intermediates products, which shed light on the future application in eliminating drugs using UV /bisulfite.",,10.1016/j.chemosphere.2023.137741,Carbamazepine,NA,,photocatalysis of carbamazepine via activating bisulfite by ultraviolet performance transformation mechanism and residual toxicity assessment of intermediates products
rayyan-1259295095,Research status and prospects of microplastic pollution in lakes,2023,4,NA,ENVIRONMENTAL MONITORING AND ASSESSMENT,0167-6369,195,4,,"Li, Tong and Zhang, Weiqing and Yu, Hui and Hai, Chunxing and Wang, Yong and Yu, Shan and Tsedevdorj, Ser-Od",,,,,"As an emerging pollutant, microplastics have attracted widespread concern around the world. Research on microplastics was first conducted in oceans, and in recent years, inland water, especially lakes, has gradually become a hot spot. This paper systematically reviews the sampling, separation, purification, and identification technologies used to assess microplastics in lakes and summarizes the occurrence of lake microplastics worldwide. The results show that microplastics are widespread in lake water and sediment. There are obvious geographical differences in the occurrence of microplastics. The abundance of microplastics in different lakes varies greatly. The forms are mostly fibrous and fragments, and the main polymers are polypropylene (PP) and polyethylene (PE). Previous papers have failed to comment in as much detail on the microplastic sampling techniques employed within lake systems. The sampling and analysis methods are critical to accurately evaluating contamination results. Due to the widespread presence of microplastics and the lack of uniform standards, there are various sampling methods. Trawls and grabs are most widely used in the sampling of lake water bodies and sediment, and sodium chloride and hydrogen peroxide are the most widely used media for flotation and digestion, respectively. In the future, it will be critical to establish unified standards for lake microplastic sampling and analysis technology, further explore the migration mechanism of microplastics in lake systems, and pay attention to the impact of microplastics on lake ecosystems.",,10.1007/s10661-023-11043-w,,NA,,research status and prospects of microplastic pollution in lakes
